"id","structure","post_date","comm_date","num_comments","subreddit","upvote_prop","post_score","author","user","comment_score","controversiality","comment","title","post_text","link","domain","URL"
327,"28_3","24-06-19","25-06-19",511,"politics",0.97,4225,"real--life","sandwooder",12,0,"This is one of the biggest misconceptions I see on social media. Family separations for the purposes of deterrence do not predate the Trump administration. Before Trump, including under President Obama, immigrant families were only separated if border agents believed that a child was in danger, such as when they suspected that a person claiming to be a parent was actually a human trafficker, or if the parent had an extensive criminal record that could impact their ability to keep the child safe.

Its true that border agents have always had discretion in deciding who is a danger to a child and who is not, but interviews that my colleagues and I have conducted with career officials (as opposed to political appointees) at federal immigration agencies suggest that separations are far more common today than they were under any previous administration. The ongoing separations are being tracked as part of a federal lawsuit out of the Southern District of California, for those who are interested. Im linking here again to a recent story I reported with my colleague Miriam Jordan, which helps to explain: https://www.nytimes.com/2019/03/09/us/migrant-family-separations-border.html  - Caitlan Dickerson","60,000 child migrants detained by US in last 40 days","","https://www.bbc.com/news/av/world-us-canada-48602222/60000-child-migrants-detained-by-us-in-last-40-days?fbclid=IwAR3ubKECRlX4wRPsDJy3XaleEQLCugnVM2O4k8BwUNLSLP_igW2FocAVhZU","bbc.com","https://www.reddit.com/r/politics/comments/c4xi7j/60000_child_migrants_detained_by_us_in_last_40/?ref=search_posts"
328,"28_4","24-06-19","25-06-19",511,"politics",0.97,4225,"real--life","sign_my_guestbook",6,0,"I would have government let the kids stay with their parent(s) for one. There is NO reason for them to go through this kind of traumatic experience alone. At least with the parents at their side, the rape/molestation of these kids would be lowered significantly.","60,000 child migrants detained by US in last 40 days","","https://www.bbc.com/news/av/world-us-canada-48602222/60000-child-migrants-detained-by-us-in-last-40-days?fbclid=IwAR3ubKECRlX4wRPsDJy3XaleEQLCugnVM2O4k8BwUNLSLP_igW2FocAVhZU","bbc.com","https://www.reddit.com/r/politics/comments/c4xi7j/60000_child_migrants_detained_by_us_in_last_40/?ref=search_posts"
329,"28_5","24-06-19","25-06-19",511,"politics",0.97,4225,"real--life","Nanogrip",15,0,"People go by ""feels"" but none of these folks will ever care, host, or house any one of these thousands and thousands of illegal immigrants coming in every month.  60,000 child migrants in the past 40 days?  Goodluck to any country handling that.","60,000 child migrants detained by US in last 40 days","","https://www.bbc.com/news/av/world-us-canada-48602222/60000-child-migrants-detained-by-us-in-last-40-days?fbclid=IwAR3ubKECRlX4wRPsDJy3XaleEQLCugnVM2O4k8BwUNLSLP_igW2FocAVhZU","bbc.com","https://www.reddit.com/r/politics/comments/c4xi7j/60000_child_migrants_detained_by_us_in_last_40/?ref=search_posts"
330,"28_5_1","24-06-19","25-06-19",511,"politics",0.97,4225,"real--life","luzenelmundo",6,1,"This is a null argument. They have relatives and could be released into their care as in the past. We're keeping them in the Immigrant Industrial Complex.","60,000 child migrants detained by US in last 40 days","","https://www.bbc.com/news/av/world-us-canada-48602222/60000-child-migrants-detained-by-us-in-last-40-days?fbclid=IwAR3ubKECRlX4wRPsDJy3XaleEQLCugnVM2O4k8BwUNLSLP_igW2FocAVhZU","bbc.com","https://www.reddit.com/r/politics/comments/c4xi7j/60000_child_migrants_detained_by_us_in_last_40/?ref=search_posts"
331,"28_5_1_1","24-06-19","25-06-19",511,"politics",0.97,4225,"real--life","ryandaramfan",3,1,"Meaning that all of these kids would become citizens or that they would be sent back to relatives in their countries of origin? If the current administration started sending people back to Guatemala there would be people saying its cruel to send a minor to an unstable country. It seems like the consensus on this sub is to just take in a constant stream of unaccompanied minors, which I dont see as a reasonable solution. That would only encourage more illegal immigration. How many hundreds of thousands are we willing to take in as a country every year?","60,000 child migrants detained by US in last 40 days","","https://www.bbc.com/news/av/world-us-canada-48602222/60000-child-migrants-detained-by-us-in-last-40-days?fbclid=IwAR3ubKECRlX4wRPsDJy3XaleEQLCugnVM2O4k8BwUNLSLP_igW2FocAVhZU","bbc.com","https://www.reddit.com/r/politics/comments/c4xi7j/60000_child_migrants_detained_by_us_in_last_40/?ref=search_posts"
332,"28_5_1_1_1","24-06-19","25-06-19",511,"politics",0.97,4225,"real--life","thelastcookie",5,0,"The vast majority aren't unaccompanied, this administration defines all kids that way. They are so ""smart"", they work the loopholes to inflict maximum cruelty.","60,000 child migrants detained by US in last 40 days","","https://www.bbc.com/news/av/world-us-canada-48602222/60000-child-migrants-detained-by-us-in-last-40-days?fbclid=IwAR3ubKECRlX4wRPsDJy3XaleEQLCugnVM2O4k8BwUNLSLP_igW2FocAVhZU","bbc.com","https://www.reddit.com/r/politics/comments/c4xi7j/60000_child_migrants_detained_by_us_in_last_40/?ref=search_posts"
333,"28_5_1_1_1_1","24-06-19","25-06-19",511,"politics",0.97,4225,"real--life","ryandaramfan",0,0,"What do people have to gain by being cruel. Do you really believe elected officials are working loopholes to cause pain to children, or do you think it probably more complicated than that?","60,000 child migrants detained by US in last 40 days","","https://www.bbc.com/news/av/world-us-canada-48602222/60000-child-migrants-detained-by-us-in-last-40-days?fbclid=IwAR3ubKECRlX4wRPsDJy3XaleEQLCugnVM2O4k8BwUNLSLP_igW2FocAVhZU","bbc.com","https://www.reddit.com/r/politics/comments/c4xi7j/60000_child_migrants_detained_by_us_in_last_40/?ref=search_posts"
334,"28_5_1_1_1_1_1","24-06-19","25-06-19",511,"politics",0.97,4225,"real--life","thelastcookie",1,0,"You mean the elected official who wants to execute people proven innocent or pardon war criminals and law enforcement that bragged about running a concentration camp or wants to torture the families of suspected terrorists or who admires dictators infamous for their human rights abuses or who constantly lies and abuses their power in an obvious effort to demonize entire groups of people....the list goes on. Not to mention people appointed by said elected official. So, AB-SO-FUCKING-LUTELY do I believe cruelty is the point. Anyone who doesn't is either willfully ignorant or a sick fuck enjoying the suffering.","60,000 child migrants detained by US in last 40 days","","https://www.bbc.com/news/av/world-us-canada-48602222/60000-child-migrants-detained-by-us-in-last-40-days?fbclid=IwAR3ubKECRlX4wRPsDJy3XaleEQLCugnVM2O4k8BwUNLSLP_igW2FocAVhZU","bbc.com","https://www.reddit.com/r/politics/comments/c4xi7j/60000_child_migrants_detained_by_us_in_last_40/?ref=search_posts"
335,"28_5_1_1_1_1_1_1","24-06-19","25-06-19",511,"politics",0.97,4225,"real--life","ryandaramfan",0,0,"""So, AB-SO-FUCKING-LUTELY do I believe cruelty is the point. Anyone who doesn't is either willfully ignorant or a sick fuck enjoying the suffering"".

so there are three types of people: ignorant people, sick fucks, and people who think that trump became president for the expressed purpose of torturing families etc. Doesn't seem to logical to me. Based off of your response I think that ignorance is a little more widespread than that","60,000 child migrants detained by US in last 40 days","","https://www.bbc.com/news/av/world-us-canada-48602222/60000-child-migrants-detained-by-us-in-last-40-days?fbclid=IwAR3ubKECRlX4wRPsDJy3XaleEQLCugnVM2O4k8BwUNLSLP_igW2FocAVhZU","bbc.com","https://www.reddit.com/r/politics/comments/c4xi7j/60000_child_migrants_detained_by_us_in_last_40/?ref=search_posts"
336,"28_5_1_1_1_1_1_1_1","24-06-19","25-06-19",511,"politics",0.97,4225,"real--life","thelastcookie",1,0,"&gt;  trump became president for the expressed purpose of torturing families etc.

Haha. Nah, that's just a side gig but critical to the overall authoritarian agenda. His main purpose is obviously to take from the poor and give to the rich.","60,000 child migrants detained by US in last 40 days","","https://www.bbc.com/news/av/world-us-canada-48602222/60000-child-migrants-detained-by-us-in-last-40-days?fbclid=IwAR3ubKECRlX4wRPsDJy3XaleEQLCugnVM2O4k8BwUNLSLP_igW2FocAVhZU","bbc.com","https://www.reddit.com/r/politics/comments/c4xi7j/60000_child_migrants_detained_by_us_in_last_40/?ref=search_posts"
337,"28_5_1_1_2","24-06-19","25-06-19",511,"politics",0.97,4225,"real--life","luzenelmundo",1,0,"No. They have sponsors in the United States, verifiable family connections. They could stay with them until their asylum hearing.","60,000 child migrants detained by US in last 40 days","","https://www.bbc.com/news/av/world-us-canada-48602222/60000-child-migrants-detained-by-us-in-last-40-days?fbclid=IwAR3ubKECRlX4wRPsDJy3XaleEQLCugnVM2O4k8BwUNLSLP_igW2FocAVhZU","bbc.com","https://www.reddit.com/r/politics/comments/c4xi7j/60000_child_migrants_detained_by_us_in_last_40/?ref=search_posts"
338,"28_6","24-06-19","25-06-19",511,"politics",0.97,4225,"real--life","Russ-B-Fancy",4,0,"Maybe they should give them showers but instead of water they could use something else.. seriously though, if we can come up with 600b for bankers - + 14t in low interest loans - we can work this. Treat it like a disaster and have fema manage it.","60,000 child migrants detained by US in last 40 days","","https://www.bbc.com/news/av/world-us-canada-48602222/60000-child-migrants-detained-by-us-in-last-40-days?fbclid=IwAR3ubKECRlX4wRPsDJy3XaleEQLCugnVM2O4k8BwUNLSLP_igW2FocAVhZU","bbc.com","https://www.reddit.com/r/politics/comments/c4xi7j/60000_child_migrants_detained_by_us_in_last_40/?ref=search_posts"
339,"28_6_1","24-06-19","25-06-19",511,"politics",0.97,4225,"real--life","luzenelmundo",9,0,"People are trying to volunteer and donate. They're being turned away. Free legal aid is also being sent away. Wake up. This is our America. Past time to act.","60,000 child migrants detained by US in last 40 days","","https://www.bbc.com/news/av/world-us-canada-48602222/60000-child-migrants-detained-by-us-in-last-40-days?fbclid=IwAR3ubKECRlX4wRPsDJy3XaleEQLCugnVM2O4k8BwUNLSLP_igW2FocAVhZU","bbc.com","https://www.reddit.com/r/politics/comments/c4xi7j/60000_child_migrants_detained_by_us_in_last_40/?ref=search_posts"
340,"28_6_1_1","24-06-19","25-06-19",511,"politics",0.97,4225,"real--life","justahumaninny",4,0,"decades past time to act. but its NEVER too late, unless youre dead","60,000 child migrants detained by US in last 40 days","","https://www.bbc.com/news/av/world-us-canada-48602222/60000-child-migrants-detained-by-us-in-last-40-days?fbclid=IwAR3ubKECRlX4wRPsDJy3XaleEQLCugnVM2O4k8BwUNLSLP_igW2FocAVhZU","bbc.com","https://www.reddit.com/r/politics/comments/c4xi7j/60000_child_migrants_detained_by_us_in_last_40/?ref=search_posts"
341,"28_7","24-06-19","25-06-19",511,"politics",0.97,4225,"real--life","[deleted]",2,1,"[deleted]","60,000 child migrants detained by US in last 40 days","","https://www.bbc.com/news/av/world-us-canada-48602222/60000-child-migrants-detained-by-us-in-last-40-days?fbclid=IwAR3ubKECRlX4wRPsDJy3XaleEQLCugnVM2O4k8BwUNLSLP_igW2FocAVhZU","bbc.com","https://www.reddit.com/r/politics/comments/c4xi7j/60000_child_migrants_detained_by_us_in_last_40/?ref=search_posts"
342,"28_7_1","24-06-19","25-06-19",511,"politics",0.97,4225,"real--life","thelastcookie",4,0,"&gt; Let's go with the rational conclusion, there is a surge of people....more than usual showing up, 

How is that rational? It requires the assumption that the current administration doesn't lie their asses off at every given opportunity. But, no, let's believe in their good intentions. Maybe if you close your eyes hard enough, the world will look like a better place?","60,000 child migrants detained by US in last 40 days","","https://www.bbc.com/news/av/world-us-canada-48602222/60000-child-migrants-detained-by-us-in-last-40-days?fbclid=IwAR3ubKECRlX4wRPsDJy3XaleEQLCugnVM2O4k8BwUNLSLP_igW2FocAVhZU","bbc.com","https://www.reddit.com/r/politics/comments/c4xi7j/60000_child_migrants_detained_by_us_in_last_40/?ref=search_posts"
343,"28_7_1_1","24-06-19","25-06-19",511,"politics",0.97,4225,"real--life","[deleted]",2,0,"[deleted]","60,000 child migrants detained by US in last 40 days","","https://www.bbc.com/news/av/world-us-canada-48602222/60000-child-migrants-detained-by-us-in-last-40-days?fbclid=IwAR3ubKECRlX4wRPsDJy3XaleEQLCugnVM2O4k8BwUNLSLP_igW2FocAVhZU","bbc.com","https://www.reddit.com/r/politics/comments/c4xi7j/60000_child_migrants_detained_by_us_in_last_40/?ref=search_posts"
344,"28_7_1_1_1","24-06-19","25-06-19",511,"politics",0.97,4225,"real--life","thelastcookie",0,0,"Nope, it's not necessary to detain everyone the way they are doing. They could simply reinstate [Obama's successful program](https://qz.com/1312707/trumps-family-detention-policy-vs-obamas-more-humane-alternative-to-jailing-immigrant-families/) that was MUCH cheaper. But, that doesn't create a crisis or inflict cruelty... that's what this is all about. 

Obviously you've got some personal investment in defending this horrendous practice.. that really tells me all I need to know.","60,000 child migrants detained by US in last 40 days","","https://www.bbc.com/news/av/world-us-canada-48602222/60000-child-migrants-detained-by-us-in-last-40-days?fbclid=IwAR3ubKECRlX4wRPsDJy3XaleEQLCugnVM2O4k8BwUNLSLP_igW2FocAVhZU","bbc.com","https://www.reddit.com/r/politics/comments/c4xi7j/60000_child_migrants_detained_by_us_in_last_40/?ref=search_posts"
345,"28_7_2","24-06-19","25-06-19",511,"politics",0.97,4225,"real--life","rndljfry",2,1,"You would think the greatest country on earth^TM could find a way","60,000 child migrants detained by US in last 40 days","","https://www.bbc.com/news/av/world-us-canada-48602222/60000-child-migrants-detained-by-us-in-last-40-days?fbclid=IwAR3ubKECRlX4wRPsDJy3XaleEQLCugnVM2O4k8BwUNLSLP_igW2FocAVhZU","bbc.com","https://www.reddit.com/r/politics/comments/c4xi7j/60000_child_migrants_detained_by_us_in_last_40/?ref=search_posts"
346,"28_7_2_1","24-06-19","25-06-19",511,"politics",0.97,4225,"real--life","TheMustacheBandit",2,1,"Not with the good for nothing congress we have at the moment that refuses to do anything outside of pursue endless Russia investigations.","60,000 child migrants detained by US in last 40 days","","https://www.bbc.com/news/av/world-us-canada-48602222/60000-child-migrants-detained-by-us-in-last-40-days?fbclid=IwAR3ubKECRlX4wRPsDJy3XaleEQLCugnVM2O4k8BwUNLSLP_igW2FocAVhZU","bbc.com","https://www.reddit.com/r/politics/comments/c4xi7j/60000_child_migrants_detained_by_us_in_last_40/?ref=search_posts"
347,"28_7_2_1_1","24-06-19","25-06-19",511,"politics",0.97,4225,"real--life","rndljfry",2,0,"Oh you mean the Senate that refuses to legislate? The house has passed over 20 bills that are sitting in the graveyard of the Senate.","60,000 child migrants detained by US in last 40 days","","https://www.bbc.com/news/av/world-us-canada-48602222/60000-child-migrants-detained-by-us-in-last-40-days?fbclid=IwAR3ubKECRlX4wRPsDJy3XaleEQLCugnVM2O4k8BwUNLSLP_igW2FocAVhZU","bbc.com","https://www.reddit.com/r/politics/comments/c4xi7j/60000_child_migrants_detained_by_us_in_last_40/?ref=search_posts"
348,"28_7_2_2","24-06-19","25-06-19",511,"politics",0.97,4225,"real--life","jaywa1king",1,0,"It's kinda hard when you have all the democrats denying funding while calling it a ""manufactured crisis at the border"" for the better part of a year.","60,000 child migrants detained by US in last 40 days","","https://www.bbc.com/news/av/world-us-canada-48602222/60000-child-migrants-detained-by-us-in-last-40-days?fbclid=IwAR3ubKECRlX4wRPsDJy3XaleEQLCugnVM2O4k8BwUNLSLP_igW2FocAVhZU","bbc.com","https://www.reddit.com/r/politics/comments/c4xi7j/60000_child_migrants_detained_by_us_in_last_40/?ref=search_posts"
349,"28_7_2_2_1","24-06-19","25-06-19",511,"politics",0.97,4225,"real--life","rndljfry",1,0,"Trump turned down $25,000,000,000 in funding when he had a unified Congress under Republican control.","60,000 child migrants detained by US in last 40 days","","https://www.bbc.com/news/av/world-us-canada-48602222/60000-child-migrants-detained-by-us-in-last-40-days?fbclid=IwAR3ubKECRlX4wRPsDJy3XaleEQLCugnVM2O4k8BwUNLSLP_igW2FocAVhZU","bbc.com","https://www.reddit.com/r/politics/comments/c4xi7j/60000_child_migrants_detained_by_us_in_last_40/?ref=search_posts"
350,"28_8","24-06-19","25-06-19",511,"politics",0.97,4225,"real--life","intercontinentalbelt",1,0,"There could be a procedure where we send them back to their parents for one. Why do we keep the children and send the parents back? We could create an infrastructure to deal with this in a humane way.","60,000 child migrants detained by US in last 40 days","","https://www.bbc.com/news/av/world-us-canada-48602222/60000-child-migrants-detained-by-us-in-last-40-days?fbclid=IwAR3ubKECRlX4wRPsDJy3XaleEQLCugnVM2O4k8BwUNLSLP_igW2FocAVhZU","bbc.com","https://www.reddit.com/r/politics/comments/c4xi7j/60000_child_migrants_detained_by_us_in_last_40/?ref=search_posts"
351,"28_8_1","24-06-19","25-06-19",511,"politics",0.97,4225,"real--life","peppercorns666",4,0,"great question. what happens to these children? will they ever see their families again?","60,000 child migrants detained by US in last 40 days","","https://www.bbc.com/news/av/world-us-canada-48602222/60000-child-migrants-detained-by-us-in-last-40-days?fbclid=IwAR3ubKECRlX4wRPsDJy3XaleEQLCugnVM2O4k8BwUNLSLP_igW2FocAVhZU","bbc.com","https://www.reddit.com/r/politics/comments/c4xi7j/60000_child_migrants_detained_by_us_in_last_40/?ref=search_posts"
352,"28_8_1_1","24-06-19","25-06-19",511,"politics",0.97,4225,"real--life","intercontinentalbelt",8,0,"They don't know what families to send them back to. They have no clue.

If you can't repatriate someone because you don't know where they're from than you would think you would have to make them a citizen. All these toddlers have no clue what country they're from. The best way to stop illegal immigration clearly.","60,000 child migrants detained by US in last 40 days","","https://www.bbc.com/news/av/world-us-canada-48602222/60000-child-migrants-detained-by-us-in-last-40-days?fbclid=IwAR3ubKECRlX4wRPsDJy3XaleEQLCugnVM2O4k8BwUNLSLP_igW2FocAVhZU","bbc.com","https://www.reddit.com/r/politics/comments/c4xi7j/60000_child_migrants_detained_by_us_in_last_40/?ref=search_posts"
353,"28_8_1_1_1","24-06-19","25-06-19",511,"politics",0.97,4225,"real--life","peppercorns666",3,0,"which kills me and i was being facetious... So why do this in the first place? theyll become our ward in the end, no?

what has this achieved other than hurting kids?!","60,000 child migrants detained by US in last 40 days","","https://www.bbc.com/news/av/world-us-canada-48602222/60000-child-migrants-detained-by-us-in-last-40-days?fbclid=IwAR3ubKECRlX4wRPsDJy3XaleEQLCugnVM2O4k8BwUNLSLP_igW2FocAVhZU","bbc.com","https://www.reddit.com/r/politics/comments/c4xi7j/60000_child_migrants_detained_by_us_in_last_40/?ref=search_posts"
354,"28_8_1_1_1_1","24-06-19","25-06-19",511,"politics",0.97,4225,"real--life","intercontinentalbelt",4,0,"Totally. It just boggles the mind. Evil to be evil. But hey they're all in for profit holding cells owned by republican politicians and their friends and family so fuck it right?","60,000 child migrants detained by US in last 40 days","","https://www.bbc.com/news/av/world-us-canada-48602222/60000-child-migrants-detained-by-us-in-last-40-days?fbclid=IwAR3ubKECRlX4wRPsDJy3XaleEQLCugnVM2O4k8BwUNLSLP_igW2FocAVhZU","bbc.com","https://www.reddit.com/r/politics/comments/c4xi7j/60000_child_migrants_detained_by_us_in_last_40/?ref=search_posts"
355,"28_8_1_1_1_1_1","24-06-19","25-06-19",511,"politics",0.97,4225,"real--life","peppercorns666",4,0,"i just dont know.  that poor girl in the photo. shes my daughters age. id die if age was taken away from me and i dont even want to think about what would happen to her.","60,000 child migrants detained by US in last 40 days","","https://www.bbc.com/news/av/world-us-canada-48602222/60000-child-migrants-detained-by-us-in-last-40-days?fbclid=IwAR3ubKECRlX4wRPsDJy3XaleEQLCugnVM2O4k8BwUNLSLP_igW2FocAVhZU","bbc.com","https://www.reddit.com/r/politics/comments/c4xi7j/60000_child_migrants_detained_by_us_in_last_40/?ref=search_posts"
356,"28_8_1_1_1_1_1_1","24-06-19","25-06-19",511,"politics",0.97,4225,"real--life","intercontinentalbelt",5,0,"Yeah reading stories about parents back in their home country trying to get their kids back kills me. Like how do we send them back and not the kids. What in the actual fuck.","60,000 child migrants detained by US in last 40 days","","https://www.bbc.com/news/av/world-us-canada-48602222/60000-child-migrants-detained-by-us-in-last-40-days?fbclid=IwAR3ubKECRlX4wRPsDJy3XaleEQLCugnVM2O4k8BwUNLSLP_igW2FocAVhZU","bbc.com","https://www.reddit.com/r/politics/comments/c4xi7j/60000_child_migrants_detained_by_us_in_last_40/?ref=search_posts"
357,"28_8_1_1_1_2","24-06-19","25-06-19",511,"politics",0.97,4225,"real--life","thelastcookie",0,0,"Hey, nice Christian families are still going to need cheap labor... and sex slaves... and brown people to blame things on. This is the GOP thinking long term.","60,000 child migrants detained by US in last 40 days","","https://www.bbc.com/news/av/world-us-canada-48602222/60000-child-migrants-detained-by-us-in-last-40-days?fbclid=IwAR3ubKECRlX4wRPsDJy3XaleEQLCugnVM2O4k8BwUNLSLP_igW2FocAVhZU","bbc.com","https://www.reddit.com/r/politics/comments/c4xi7j/60000_child_migrants_detained_by_us_in_last_40/?ref=search_posts"
358,"28_8_1_2","24-06-19","25-06-19",511,"politics",0.97,4225,"real--life","philmoeslim",3,0,"1st procedure would be stopping the separation.....","60,000 child migrants detained by US in last 40 days","","https://www.bbc.com/news/av/world-us-canada-48602222/60000-child-migrants-detained-by-us-in-last-40-days?fbclid=IwAR3ubKECRlX4wRPsDJy3XaleEQLCugnVM2O4k8BwUNLSLP_igW2FocAVhZU","bbc.com","https://www.reddit.com/r/politics/comments/c4xi7j/60000_child_migrants_detained_by_us_in_last_40/?ref=search_posts"
359,"28_8_1_2_1","24-06-19","25-06-19",511,"politics",0.97,4225,"real--life","PlumbPitt",0,0,"First procedure stop crossing the border illegally. Most are not crossing at designated stations, most cross in the middle of nowhere and when caught claim asylum just like they were taught before coming this far.","60,000 child migrants detained by US in last 40 days","","https://www.bbc.com/news/av/world-us-canada-48602222/60000-child-migrants-detained-by-us-in-last-40-days?fbclid=IwAR3ubKECRlX4wRPsDJy3XaleEQLCugnVM2O4k8BwUNLSLP_igW2FocAVhZU","bbc.com","https://www.reddit.com/r/politics/comments/c4xi7j/60000_child_migrants_detained_by_us_in_last_40/?ref=search_posts"
360,"28_8_1_2_1_1","24-06-19","25-06-19",511,"politics",0.97,4225,"real--life","[deleted]",1,0,"[deleted]","60,000 child migrants detained by US in last 40 days","","https://www.bbc.com/news/av/world-us-canada-48602222/60000-child-migrants-detained-by-us-in-last-40-days?fbclid=IwAR3ubKECRlX4wRPsDJy3XaleEQLCugnVM2O4k8BwUNLSLP_igW2FocAVhZU","bbc.com","https://www.reddit.com/r/politics/comments/c4xi7j/60000_child_migrants_detained_by_us_in_last_40/?ref=search_posts"
361,"28_8_2","24-06-19","25-06-19",511,"politics",0.97,4225,"real--life","74orangebeetle",-3,0,"I mean, the parents probably aren't great if they took their kids there and put them through this in the first place.","60,000 child migrants detained by US in last 40 days","","https://www.bbc.com/news/av/world-us-canada-48602222/60000-child-migrants-detained-by-us-in-last-40-days?fbclid=IwAR3ubKECRlX4wRPsDJy3XaleEQLCugnVM2O4k8BwUNLSLP_igW2FocAVhZU","bbc.com","https://www.reddit.com/r/politics/comments/c4xi7j/60000_child_migrants_detained_by_us_in_last_40/?ref=search_posts"
362,"28_8_2_1","24-06-19","25-06-19",511,"politics",0.97,4225,"real--life","PM_ME_BEER",1,0,"""Hmm why would a parent take such a risk with their children? Could it be that their situation back in their home country was so bad they saw basically no other option? ...Nah it's probably bad parenting.""","60,000 child migrants detained by US in last 40 days","","https://www.bbc.com/news/av/world-us-canada-48602222/60000-child-migrants-detained-by-us-in-last-40-days?fbclid=IwAR3ubKECRlX4wRPsDJy3XaleEQLCugnVM2O4k8BwUNLSLP_igW2FocAVhZU","bbc.com","https://www.reddit.com/r/politics/comments/c4xi7j/60000_child_migrants_detained_by_us_in_last_40/?ref=search_posts"
