"id","structure","post_date","comm_date","num_comments","subreddit","upvote_prop","post_score","author","user","comment_score","controversiality","comment","title","post_text","link","domain","URL"
103,"2_2_2_12_1","24-06-19","25-06-19",511,"politics",0.97,4225,"real--life","DontWalkRun",1,0,"I share the exact same sentiment as you.","60,000 child migrants detained by US in last 40 days","","https://www.bbc.com/news/av/world-us-canada-48602222/60000-child-migrants-detained-by-us-in-last-40-days?fbclid=IwAR3ubKECRlX4wRPsDJy3XaleEQLCugnVM2O4k8BwUNLSLP_igW2FocAVhZU","bbc.com","https://www.reddit.com/r/politics/comments/c4xi7j/60000_child_migrants_detained_by_us_in_last_40/?ref=search_posts"
104,"2_3","24-06-19","25-06-19",511,"politics",0.97,4225,"real--life","swarlay",15,0,"[Well...](https://www.youtube.com/watch?v=bijsl9p55qo&amp;t=39) /s","60,000 child migrants detained by US in last 40 days","","https://www.bbc.com/news/av/world-us-canada-48602222/60000-child-migrants-detained-by-us-in-last-40-days?fbclid=IwAR3ubKECRlX4wRPsDJy3XaleEQLCugnVM2O4k8BwUNLSLP_igW2FocAVhZU","bbc.com","https://www.reddit.com/r/politics/comments/c4xi7j/60000_child_migrants_detained_by_us_in_last_40/?ref=search_posts"
105,"2_3_1","24-06-19","25-06-19",511,"politics",0.97,4225,"real--life","FadedRebel",9,0,"That is so fucked...","60,000 child migrants detained by US in last 40 days","","https://www.bbc.com/news/av/world-us-canada-48602222/60000-child-migrants-detained-by-us-in-last-40-days?fbclid=IwAR3ubKECRlX4wRPsDJy3XaleEQLCugnVM2O4k8BwUNLSLP_igW2FocAVhZU","bbc.com","https://www.reddit.com/r/politics/comments/c4xi7j/60000_child_migrants_detained_by_us_in_last_40/?ref=search_posts"
106,"2_4","24-06-19","25-06-19",511,"politics",0.97,4225,"real--life","Captcha_Imagination",5,0,"If 1 American child was detained in this state by a foreign actor, it would be front page news and a huge diplomatic incident. More than one could be war.","60,000 child migrants detained by US in last 40 days","","https://www.bbc.com/news/av/world-us-canada-48602222/60000-child-migrants-detained-by-us-in-last-40-days?fbclid=IwAR3ubKECRlX4wRPsDJy3XaleEQLCugnVM2O4k8BwUNLSLP_igW2FocAVhZU","bbc.com","https://www.reddit.com/r/politics/comments/c4xi7j/60000_child_migrants_detained_by_us_in_last_40/?ref=search_posts"
107,"2_5","24-06-19","25-06-19",511,"politics",0.97,4225,"real--life","BoggleSwitch",7,0,"Funneling nearly $1K per child per day into the Prison Industrial Complex","60,000 child migrants detained by US in last 40 days","","https://www.bbc.com/news/av/world-us-canada-48602222/60000-child-migrants-detained-by-us-in-last-40-days?fbclid=IwAR3ubKECRlX4wRPsDJy3XaleEQLCugnVM2O4k8BwUNLSLP_igW2FocAVhZU","bbc.com","https://www.reddit.com/r/politics/comments/c4xi7j/60000_child_migrants_detained_by_us_in_last_40/?ref=search_posts"
108,"2_6","24-06-19","25-06-19",511,"politics",0.97,4225,"real--life","Irythros",3,0,"About 20k less than the state of Wyoming.","60,000 child migrants detained by US in last 40 days","","https://www.bbc.com/news/av/world-us-canada-48602222/60000-child-migrants-detained-by-us-in-last-40-days?fbclid=IwAR3ubKECRlX4wRPsDJy3XaleEQLCugnVM2O4k8BwUNLSLP_igW2FocAVhZU","bbc.com","https://www.reddit.com/r/politics/comments/c4xi7j/60000_child_migrants_detained_by_us_in_last_40/?ref=search_posts"
109,"2_7","24-06-19","25-06-19",511,"politics",0.97,4225,"real--life","EmilioEstevezQuake",3,0,"And multiply that times $750.00/day minus costs, so like $747.43/day.","60,000 child migrants detained by US in last 40 days","","https://www.bbc.com/news/av/world-us-canada-48602222/60000-child-migrants-detained-by-us-in-last-40-days?fbclid=IwAR3ubKECRlX4wRPsDJy3XaleEQLCugnVM2O4k8BwUNLSLP_igW2FocAVhZU","bbc.com","https://www.reddit.com/r/politics/comments/c4xi7j/60000_child_migrants_detained_by_us_in_last_40/?ref=search_posts"
110,"2_8","24-06-19","25-06-19",511,"politics",0.97,4225,"real--life","[deleted]",3,1,"[deleted]","60,000 child migrants detained by US in last 40 days","","https://www.bbc.com/news/av/world-us-canada-48602222/60000-child-migrants-detained-by-us-in-last-40-days?fbclid=IwAR3ubKECRlX4wRPsDJy3XaleEQLCugnVM2O4k8BwUNLSLP_igW2FocAVhZU","bbc.com","https://www.reddit.com/r/politics/comments/c4xi7j/60000_child_migrants_detained_by_us_in_last_40/?ref=search_posts"
111,"2_8_1","24-06-19","25-06-19",511,"politics",0.97,4225,"real--life","Randomabcd1234",6,0,"It isnt standard international law to require refugees to seek asylum in the first country they can. That was part of an agreement the EU made that was specific to them, it's not a universal rule.

Some of them are seeking refuge in Mexico, but if they feel like they still won't be safe enough in Mexico, there is no reason they can't keep going to the US or Canada.","60,000 child migrants detained by US in last 40 days","","https://www.bbc.com/news/av/world-us-canada-48602222/60000-child-migrants-detained-by-us-in-last-40-days?fbclid=IwAR3ubKECRlX4wRPsDJy3XaleEQLCugnVM2O4k8BwUNLSLP_igW2FocAVhZU","bbc.com","https://www.reddit.com/r/politics/comments/c4xi7j/60000_child_migrants_detained_by_us_in_last_40/?ref=search_posts"
112,"2_8_1_1","24-06-19","25-06-19",511,"politics",0.97,4225,"real--life","Zebulah_Crimson",1,0,"Did not know that, thank you for the info.

If I was in their shoes I would totally want to take refuge in the US. We have the strongest economy and are extremely safe compared to most countries in the region. However, what worries me is that we can't just absorb everyone in Central America and elsewhere you wants to join us. There is a limit to what our economy can handle (especially if we plan of giving them benefits like social security, Medicare, and others)","60,000 child migrants detained by US in last 40 days","","https://www.bbc.com/news/av/world-us-canada-48602222/60000-child-migrants-detained-by-us-in-last-40-days?fbclid=IwAR3ubKECRlX4wRPsDJy3XaleEQLCugnVM2O4k8BwUNLSLP_igW2FocAVhZU","bbc.com","https://www.reddit.com/r/politics/comments/c4xi7j/60000_child_migrants_detained_by_us_in_last_40/?ref=search_posts"
113,"2_8_1_1_1","24-06-19","25-06-19",511,"politics",0.97,4225,"real--life","Randomabcd1234",3,0,"I get those concerns, but they're going to keep coming regardless of what we do at the border as long as the conditions in their home countries are so bad. We need to invest in those countries to help ourselves.","60,000 child migrants detained by US in last 40 days","","https://www.bbc.com/news/av/world-us-canada-48602222/60000-child-migrants-detained-by-us-in-last-40-days?fbclid=IwAR3ubKECRlX4wRPsDJy3XaleEQLCugnVM2O4k8BwUNLSLP_igW2FocAVhZU","bbc.com","https://www.reddit.com/r/politics/comments/c4xi7j/60000_child_migrants_detained_by_us_in_last_40/?ref=search_posts"
114,"2_8_1_1_1_1","24-06-19","25-06-19",511,"politics",0.97,4225,"real--life","Zebulah_Crimson",2,0,"Wow, I can actually get behind that sentiment. Private (American) investment into central would be great for both countries - sadly tariffs while useful in our specific case as a negotiating tool, make attempts like this next to impossible.


I would be totally fine with this happening though. China is doing something similar in Africa right now - build infrastructure in tons of poorer country and give a ~30 year loan to said country. When the loans expires if they can pay it back you made some money, if not you now exercise some control over that country.

Edit: Also thank you to everyone for having a conversation about this. Often times differing opinions just get down-voted to oblivion and ignored.","60,000 child migrants detained by US in last 40 days","","https://www.bbc.com/news/av/world-us-canada-48602222/60000-child-migrants-detained-by-us-in-last-40-days?fbclid=IwAR3ubKECRlX4wRPsDJy3XaleEQLCugnVM2O4k8BwUNLSLP_igW2FocAVhZU","bbc.com","https://www.reddit.com/r/politics/comments/c4xi7j/60000_child_migrants_detained_by_us_in_last_40/?ref=search_posts"
115,"2_8_1_1_1_1_1","24-06-19","25-06-19",511,"politics",0.97,4225,"real--life","Randomabcd1234",2,0,"Not only is Trump in a bad position to negotiate a deal on this, but he's actually pulling back on aid the US gives to those countries to combat poverty, drugs, violence, etc. He sees it as us being ""tough"" on them to force them to get their act together, but really it's just reducing their capacity to actually deal with those issues, which will make the migration problem worse.","60,000 child migrants detained by US in last 40 days","","https://www.bbc.com/news/av/world-us-canada-48602222/60000-child-migrants-detained-by-us-in-last-40-days?fbclid=IwAR3ubKECRlX4wRPsDJy3XaleEQLCugnVM2O4k8BwUNLSLP_igW2FocAVhZU","bbc.com","https://www.reddit.com/r/politics/comments/c4xi7j/60000_child_migrants_detained_by_us_in_last_40/?ref=search_posts"
116,"2_8_1_1_1_1_1_1","24-06-19","25-06-19",511,"politics",0.97,4225,"real--life","Zebulah_Crimson",0,0,"Personally I'm against all forms of foreign  ""aid"". I'm extremely pro-foreign investment though. If we are sending millions/billions overseas we should be getting be acquiring ownership of something or debt of some kind.

I agree though that trump is in a terrible position to negotiate a deal. I would say though that if I wanted a wall (I don't want a literal wall) I would do exactly what Trump is doing. Burn all the other bridges and leave America with one feasible option: a ""big beautiful wall""","60,000 child migrants detained by US in last 40 days","","https://www.bbc.com/news/av/world-us-canada-48602222/60000-child-migrants-detained-by-us-in-last-40-days?fbclid=IwAR3ubKECRlX4wRPsDJy3XaleEQLCugnVM2O4k8BwUNLSLP_igW2FocAVhZU","bbc.com","https://www.reddit.com/r/politics/comments/c4xi7j/60000_child_migrants_detained_by_us_in_last_40/?ref=search_posts"
117,"2_8_1_1_1_1_1_1_1","24-06-19","25-06-19",511,"politics",0.97,4225,"real--life","Scientific_Methods",2,0,"Foreign aid is already an investment. We don't go around giving money away if we don't think it will benefit the U.S. in some way.","60,000 child migrants detained by US in last 40 days","","https://www.bbc.com/news/av/world-us-canada-48602222/60000-child-migrants-detained-by-us-in-last-40-days?fbclid=IwAR3ubKECRlX4wRPsDJy3XaleEQLCugnVM2O4k8BwUNLSLP_igW2FocAVhZU","bbc.com","https://www.reddit.com/r/politics/comments/c4xi7j/60000_child_migrants_detained_by_us_in_last_40/?ref=search_posts"
118,"2_8_1_1_1_1_1_1_1_1","24-06-19","25-06-19",511,"politics",0.97,4225,"real--life","Zebulah_Crimson",1,0,"When I say foreign investment I mean deals that in which countries or companies go into debt to the US.","60,000 child migrants detained by US in last 40 days","","https://www.bbc.com/news/av/world-us-canada-48602222/60000-child-migrants-detained-by-us-in-last-40-days?fbclid=IwAR3ubKECRlX4wRPsDJy3XaleEQLCugnVM2O4k8BwUNLSLP_igW2FocAVhZU","bbc.com","https://www.reddit.com/r/politics/comments/c4xi7j/60000_child_migrants_detained_by_us_in_last_40/?ref=search_posts"
119,"2_8_1_1_1_1_1_1_2","24-06-19","25-06-19",511,"politics",0.97,4225,"real--life","Randomabcd1234",1,0,"Foreign ""aid"" is kind of a misnomer in that we rarely ever do it just for the sake of helping. Usually we spend money in other countries so it will benefit us in some (often intangible) way.","60,000 child migrants detained by US in last 40 days","","https://www.bbc.com/news/av/world-us-canada-48602222/60000-child-migrants-detained-by-us-in-last-40-days?fbclid=IwAR3ubKECRlX4wRPsDJy3XaleEQLCugnVM2O4k8BwUNLSLP_igW2FocAVhZU","bbc.com","https://www.reddit.com/r/politics/comments/c4xi7j/60000_child_migrants_detained_by_us_in_last_40/?ref=search_posts"
120,"2_8_1_1_1_2","24-06-19","25-06-19",511,"politics",0.97,4225,"real--life","BitterLeif",0,0,"Bechtel invested in Bolivia.","60,000 child migrants detained by US in last 40 days","","https://www.bbc.com/news/av/world-us-canada-48602222/60000-child-migrants-detained-by-us-in-last-40-days?fbclid=IwAR3ubKECRlX4wRPsDJy3XaleEQLCugnVM2O4k8BwUNLSLP_igW2FocAVhZU","bbc.com","https://www.reddit.com/r/politics/comments/c4xi7j/60000_child_migrants_detained_by_us_in_last_40/?ref=search_posts"
121,"2_8_1_1_1_2_1","24-06-19","25-06-19",511,"politics",0.97,4225,"real--life","Randomabcd1234",1,0,"Okay. And?","60,000 child migrants detained by US in last 40 days","","https://www.bbc.com/news/av/world-us-canada-48602222/60000-child-migrants-detained-by-us-in-last-40-days?fbclid=IwAR3ubKECRlX4wRPsDJy3XaleEQLCugnVM2O4k8BwUNLSLP_igW2FocAVhZU","bbc.com","https://www.reddit.com/r/politics/comments/c4xi7j/60000_child_migrants_detained_by_us_in_last_40/?ref=search_posts"
122,"2_8_1_1_1_2_1_1","24-06-19","25-06-19",511,"politics",0.97,4225,"real--life","BitterLeif",0,0,"You're the one who expressed interest.  It's a US company that invested in in Bolivia.  There are other companies that invested in central America if you want other examples.","60,000 child migrants detained by US in last 40 days","","https://www.bbc.com/news/av/world-us-canada-48602222/60000-child-migrants-detained-by-us-in-last-40-days?fbclid=IwAR3ubKECRlX4wRPsDJy3XaleEQLCugnVM2O4k8BwUNLSLP_igW2FocAVhZU","bbc.com","https://www.reddit.com/r/politics/comments/c4xi7j/60000_child_migrants_detained_by_us_in_last_40/?ref=search_posts"
123,"2_8_1_1_1_2_1_1_1","24-06-19","25-06-19",511,"politics",0.97,4225,"real--life","Randomabcd1234",2,0,"I'm saying the US government should put more resources towards improving central American states.","60,000 child migrants detained by US in last 40 days","","https://www.bbc.com/news/av/world-us-canada-48602222/60000-child-migrants-detained-by-us-in-last-40-days?fbclid=IwAR3ubKECRlX4wRPsDJy3XaleEQLCugnVM2O4k8BwUNLSLP_igW2FocAVhZU","bbc.com","https://www.reddit.com/r/politics/comments/c4xi7j/60000_child_migrants_detained_by_us_in_last_40/?ref=search_posts"
124,"2_8_2","24-06-19","25-06-19",511,"politics",0.97,4225,"real--life","[deleted]",2,0,"You just want to drop them off at the border immediately after picking them up?","60,000 child migrants detained by US in last 40 days","","https://www.bbc.com/news/av/world-us-canada-48602222/60000-child-migrants-detained-by-us-in-last-40-days?fbclid=IwAR3ubKECRlX4wRPsDJy3XaleEQLCugnVM2O4k8BwUNLSLP_igW2FocAVhZU","bbc.com","https://www.reddit.com/r/politics/comments/c4xi7j/60000_child_migrants_detained_by_us_in_last_40/?ref=search_posts"
125,"2_8_2_1","24-06-19","25-06-19",511,"politics",0.97,4225,"real--life","Zebulah_Crimson",0,0,"I think they should give them some paperwork, take their fingerprints, and bus them 50 miles back in Mexico. They then can come to a port of entry at a set date and have an immigration hearing. We need more judges though. It is unfair for us and them that there is a multi year waiting period.","60,000 child migrants detained by US in last 40 days","","https://www.bbc.com/news/av/world-us-canada-48602222/60000-child-migrants-detained-by-us-in-last-40-days?fbclid=IwAR3ubKECRlX4wRPsDJy3XaleEQLCugnVM2O4k8BwUNLSLP_igW2FocAVhZU","bbc.com","https://www.reddit.com/r/politics/comments/c4xi7j/60000_child_migrants_detained_by_us_in_last_40/?ref=search_posts"
126,"2_8_2_1_1","24-06-19","25-06-19",511,"politics",0.97,4225,"real--life","[deleted]",1,0,"[deleted]","60,000 child migrants detained by US in last 40 days","","https://www.bbc.com/news/av/world-us-canada-48602222/60000-child-migrants-detained-by-us-in-last-40-days?fbclid=IwAR3ubKECRlX4wRPsDJy3XaleEQLCugnVM2O4k8BwUNLSLP_igW2FocAVhZU","bbc.com","https://www.reddit.com/r/politics/comments/c4xi7j/60000_child_migrants_detained_by_us_in_last_40/?ref=search_posts"
127,"2_8_2_1_1_1","24-06-19","25-06-19",511,"politics",0.97,4225,"real--life","Zebulah_Crimson",1,0,"If they are Mexican citizens they have to accept them - no choice in the matter. And I believe that (surprising enough) Trump managed to negotiate something with Mexico where they agreed to take the Central America migrants in - this might only apply to the caravans though.

Whatever the situation is though the solution needs to involve more immigration judges. They should have their hearing within 1 week of entering the US before they are released into the country. That way we no longer have the issue of migrants skipping their court dates and staying illegally.","60,000 child migrants detained by US in last 40 days","","https://www.bbc.com/news/av/world-us-canada-48602222/60000-child-migrants-detained-by-us-in-last-40-days?fbclid=IwAR3ubKECRlX4wRPsDJy3XaleEQLCugnVM2O4k8BwUNLSLP_igW2FocAVhZU","bbc.com","https://www.reddit.com/r/politics/comments/c4xi7j/60000_child_migrants_detained_by_us_in_last_40/?ref=search_posts"
128,"2_9","24-06-19","25-06-19",511,"politics",0.97,4225,"real--life","daniel_ricciardo",3,1,"Okay this is a fucking concentration camp","60,000 child migrants detained by US in last 40 days","","https://www.bbc.com/news/av/world-us-canada-48602222/60000-child-migrants-detained-by-us-in-last-40-days?fbclid=IwAR3ubKECRlX4wRPsDJy3XaleEQLCugnVM2O4k8BwUNLSLP_igW2FocAVhZU","bbc.com","https://www.reddit.com/r/politics/comments/c4xi7j/60000_child_migrants_detained_by_us_in_last_40/?ref=search_posts"
129,"2_10","24-06-19","25-06-19",511,"politics",0.97,4225,"real--life","laconicflow",3,1,"Two things, how many of those Children have since been released, and second, I don't want to take in that many people a year, period, that's not counting the adults and it isn't counting the 1.3 million legal immigrants we invite every year. 

I'm a democrat, I'll never vote for Trump, but if anyone's wondering why he gets votes, its partly shit like this. 

Someone good at geography tell me how many countries someone from Honduras walks through before they reach this country. And then someone tell me how many of those countries are safer than Honduras. And then someone explain to me why these folks aren't forced to claim asylum in the first country they enter after leaving their own, as is common practice in Europe.","60,000 child migrants detained by US in last 40 days","","https://www.bbc.com/news/av/world-us-canada-48602222/60000-child-migrants-detained-by-us-in-last-40-days?fbclid=IwAR3ubKECRlX4wRPsDJy3XaleEQLCugnVM2O4k8BwUNLSLP_igW2FocAVhZU","bbc.com","https://www.reddit.com/r/politics/comments/c4xi7j/60000_child_migrants_detained_by_us_in_last_40/?ref=search_posts"
130,"2_10_1","24-06-19","25-06-19",511,"politics",0.97,4225,"real--life","[deleted]",4,0,"[deleted]","60,000 child migrants detained by US in last 40 days","","https://www.bbc.com/news/av/world-us-canada-48602222/60000-child-migrants-detained-by-us-in-last-40-days?fbclid=IwAR3ubKECRlX4wRPsDJy3XaleEQLCugnVM2O4k8BwUNLSLP_igW2FocAVhZU","bbc.com","https://www.reddit.com/r/politics/comments/c4xi7j/60000_child_migrants_detained_by_us_in_last_40/?ref=search_posts"
131,"2_10_1_1","24-06-19","25-06-19",511,"politics",0.97,4225,"real--life","laconicflow",0,1,"When I read the NewYork times they say that Journey's a thousand or more miles. If we're being honest, do we assume the shortest path is the one being used generally?","60,000 child migrants detained by US in last 40 days","","https://www.bbc.com/news/av/world-us-canada-48602222/60000-child-migrants-detained-by-us-in-last-40-days?fbclid=IwAR3ubKECRlX4wRPsDJy3XaleEQLCugnVM2O4k8BwUNLSLP_igW2FocAVhZU","bbc.com","https://www.reddit.com/r/politics/comments/c4xi7j/60000_child_migrants_detained_by_us_in_last_40/?ref=search_posts"
132,"2_10_1_1_1","24-06-19","25-06-19",511,"politics",0.97,4225,"real--life","[deleted]",3,0,"[deleted]","60,000 child migrants detained by US in last 40 days","","https://www.bbc.com/news/av/world-us-canada-48602222/60000-child-migrants-detained-by-us-in-last-40-days?fbclid=IwAR3ubKECRlX4wRPsDJy3XaleEQLCugnVM2O4k8BwUNLSLP_igW2FocAVhZU","bbc.com","https://www.reddit.com/r/politics/comments/c4xi7j/60000_child_migrants_detained_by_us_in_last_40/?ref=search_posts"
133,"2_10_1_1_1_1","24-06-19","25-06-19",511,"politics",0.97,4225,"real--life","laconicflow",-2,0,"What I'm trying to ask is if there are countries these people are walking through they could ask for asylum in before they hit ours, besides Mexico. And apparently the answer is no.","60,000 child migrants detained by US in last 40 days","","https://www.bbc.com/news/av/world-us-canada-48602222/60000-child-migrants-detained-by-us-in-last-40-days?fbclid=IwAR3ubKECRlX4wRPsDJy3XaleEQLCugnVM2O4k8BwUNLSLP_igW2FocAVhZU","bbc.com","https://www.reddit.com/r/politics/comments/c4xi7j/60000_child_migrants_detained_by_us_in_last_40/?ref=search_posts"
134,"2_10_1_1_1_1_1","24-06-19","25-06-19",511,"politics",0.97,4225,"real--life","Boomscake",1,0,"They could ask, but that is not how it works.

&amp;#x200B;

Anyone seeking asylum is also allowed to cross borders and turn themselves in while inside the country.  The reason for that is because countries like to form barriers to prevent those people from successfully applying for asylum.","60,000 child migrants detained by US in last 40 days","","https://www.bbc.com/news/av/world-us-canada-48602222/60000-child-migrants-detained-by-us-in-last-40-days?fbclid=IwAR3ubKECRlX4wRPsDJy3XaleEQLCugnVM2O4k8BwUNLSLP_igW2FocAVhZU","bbc.com","https://www.reddit.com/r/politics/comments/c4xi7j/60000_child_migrants_detained_by_us_in_last_40/?ref=search_posts"
135,"2_10_1_1_1_1_1_1","24-06-19","26-06-19",511,"politics",0.97,4225,"real--life","laconicflow",1,0,"And frankly I'm fine with that. My feeling is that we take asylum seekers until we feel too overwhelmed. And it's been standard practice for at least this administration and the last to get Mexico involved in stopping these people before they reach us. Most of these people should be claiming asylum in Mexico anyway. They come here, because if given the choice between living here, or in Mexico, who would choose Mexico? Our own immigration numbers say almost no one.","60,000 child migrants detained by US in last 40 days","","https://www.bbc.com/news/av/world-us-canada-48602222/60000-child-migrants-detained-by-us-in-last-40-days?fbclid=IwAR3ubKECRlX4wRPsDJy3XaleEQLCugnVM2O4k8BwUNLSLP_igW2FocAVhZU","bbc.com","https://www.reddit.com/r/politics/comments/c4xi7j/60000_child_migrants_detained_by_us_in_last_40/?ref=search_posts"
136,"2_10_2","24-06-19","25-06-19",511,"politics",0.97,4225,"real--life","Scientific_Methods",1,0,"&gt; don't want to take in that many people a year, period,

They are coming here already. So what's the solution? I don't think there is a good one short term. But keeping kids in concentration camps is certainly not a viable option. Long-term we need to be investing in these south/central american countries like Honduras to improve conditions there and slow the number of asylum seekers coming to the U.S.","60,000 child migrants detained by US in last 40 days","","https://www.bbc.com/news/av/world-us-canada-48602222/60000-child-migrants-detained-by-us-in-last-40-days?fbclid=IwAR3ubKECRlX4wRPsDJy3XaleEQLCugnVM2O4k8BwUNLSLP_igW2FocAVhZU","bbc.com","https://www.reddit.com/r/politics/comments/c4xi7j/60000_child_migrants_detained_by_us_in_last_40/?ref=search_posts"
137,"2_10_2_1","24-06-19","26-06-19",511,"politics",0.97,4225,"real--life","laconicflow",1,0,"First, we don't keep the kids there long term. That's why the term concentration camp is wrong. It's 21 days max, so when you see a headline that says the US has detained sixty-thousand children this year, most of those kids are now living in the country because they've been handed off to sponsors already here. The law that demands we separate children from anyone who isn't their legal guardian existed before this administration. Its confusing because last year, Trump did something new, and bad, by separating children and their biological parents, but this current child separation issue existed in previous administrations.

And I don't want to invest money in those countries. I want both the ability to stop the migrant flows and not to be blackmailed by these countries. Its like they say, ""Give us money or we'll keep sending you people."" And I don't know why we assume throwing billions of dollars at failed states is a good idea. I'm uninterested in doing it.

The only reason we have a foreign aid budget is to buy allies, to put it bluntly, and if a country can't take care of its own shit, we don't need that country as an ally.","60,000 child migrants detained by US in last 40 days","","https://www.bbc.com/news/av/world-us-canada-48602222/60000-child-migrants-detained-by-us-in-last-40-days?fbclid=IwAR3ubKECRlX4wRPsDJy3XaleEQLCugnVM2O4k8BwUNLSLP_igW2FocAVhZU","bbc.com","https://www.reddit.com/r/politics/comments/c4xi7j/60000_child_migrants_detained_by_us_in_last_40/?ref=search_posts"
138,"2_10_2_1_1","24-06-19","26-06-19",511,"politics",0.97,4225,"real--life","Scientific_Methods",1,0,"&gt;It's 21 days max, 

Kids are being separated from their parents and held for literal weeks without basic necessities in overcrowded conditions. Let's not minimize it. 

&gt;And I don't want to invest money in those countries. I want both the ability to stop the migrant flows and not to be blackmailed by these countries. 

Who's blackmailing us? No one is ""sending"" these people. Conditions where they are from are terrible and so they are leaving. How should we expect conditions to improve without some sort of investment? Sticking our head in the sand and saying ""not our problem"" doesn't solve anything. And it very much IS our problem as evidenced by the people coming here to claim asylum. 

You have a very simplistic view of foreign aid, something that attempts to address a very complex problem.","60,000 child migrants detained by US in last 40 days","","https://www.bbc.com/news/av/world-us-canada-48602222/60000-child-migrants-detained-by-us-in-last-40-days?fbclid=IwAR3ubKECRlX4wRPsDJy3XaleEQLCugnVM2O4k8BwUNLSLP_igW2FocAVhZU","bbc.com","https://www.reddit.com/r/politics/comments/c4xi7j/60000_child_migrants_detained_by_us_in_last_40/?ref=search_posts"
