"id","structure","post_date","comm_date","num_comments","subreddit","upvote_prop","post_score","author","user","comment_score","controversiality","comment","title","post_text","link","domain","URL"
1,"1","24-06-19","24-06-19",511,"politics",0.97,4225,"real--life","AutoModerator",1,0,"
As a reminder, this subreddit [is for civil discussion.](/r/politics/wiki/index#wiki_be_civil)

In general, be courteous to others. Attack ideas, not users. Personal insults, shill or troll accusations, hate speech, **any** advocating or wishing death/physical harm, and other rule violations can result in a permanent ban. 

If you see comments in violation of our rules, please report them.

***


*I am a bot, and this action was performed automatically. Please [contact the moderators of this subreddit](/message/compose/?to=/r/politics) if you have any questions or concerns.*","60,000 child migrants detained by US in last 40 days","","https://www.bbc.com/news/av/world-us-canada-48602222/60000-child-migrants-detained-by-us-in-last-40-days?fbclid=IwAR3ubKECRlX4wRPsDJy3XaleEQLCugnVM2O4k8BwUNLSLP_igW2FocAVhZU","bbc.com","https://www.reddit.com/r/politics/comments/c4xi7j/60000_child_migrants_detained_by_us_in_last_40/?ref=search_posts"
2,"2","24-06-19","24-06-19",511,"politics",0.97,4225,"real--life","BoringEvening9",436,0,"1500/day

x

365 days/year

* * * 

547,500.  That's how many child migrants we're set to detain in 1 year at this rate.","60,000 child migrants detained by US in last 40 days","","https://www.bbc.com/news/av/world-us-canada-48602222/60000-child-migrants-detained-by-us-in-last-40-days?fbclid=IwAR3ubKECRlX4wRPsDJy3XaleEQLCugnVM2O4k8BwUNLSLP_igW2FocAVhZU","bbc.com","https://www.reddit.com/r/politics/comments/c4xi7j/60000_child_migrants_detained_by_us_in_last_40/?ref=search_posts"
3,"2_1","24-06-19","25-06-19",511,"politics",0.97,4225,"real--life","real--life",234,0,"1 out of every 1250 kids in the US was detained in the last month","60,000 child migrants detained by US in last 40 days","","https://www.bbc.com/news/av/world-us-canada-48602222/60000-child-migrants-detained-by-us-in-last-40-days?fbclid=IwAR3ubKECRlX4wRPsDJy3XaleEQLCugnVM2O4k8BwUNLSLP_igW2FocAVhZU","bbc.com","https://www.reddit.com/r/politics/comments/c4xi7j/60000_child_migrants_detained_by_us_in_last_40/?ref=search_posts"
4,"2_1_1","24-06-19","25-06-19",511,"politics",0.97,4225,"real--life","KalashnaCough",205,0,"Jesus Christ. Trump needs to be stopped, Congress needs to impeach immediately. Time's up when genocide against children is going on.","60,000 child migrants detained by US in last 40 days","","https://www.bbc.com/news/av/world-us-canada-48602222/60000-child-migrants-detained-by-us-in-last-40-days?fbclid=IwAR3ubKECRlX4wRPsDJy3XaleEQLCugnVM2O4k8BwUNLSLP_igW2FocAVhZU","bbc.com","https://www.reddit.com/r/politics/comments/c4xi7j/60000_child_migrants_detained_by_us_in_last_40/?ref=search_posts"
5,"2_1_1_1","24-06-19","25-06-19",511,"politics",0.97,4225,"real--life","BoringEvening9",88,0,"Impeachment might not be enough if we cant get McConnell to care.","60,000 child migrants detained by US in last 40 days","","https://www.bbc.com/news/av/world-us-canada-48602222/60000-child-migrants-detained-by-us-in-last-40-days?fbclid=IwAR3ubKECRlX4wRPsDJy3XaleEQLCugnVM2O4k8BwUNLSLP_igW2FocAVhZU","bbc.com","https://www.reddit.com/r/politics/comments/c4xi7j/60000_child_migrants_detained_by_us_in_last_40/?ref=search_posts"
6,"2_1_1_1_1","24-06-19","25-06-19",511,"politics",0.97,4225,"real--life","KalashnaCough",101,0,"McConnell is up for re-election next year. I generally don't have a lot of faith in Kentucky voters (sorry, liberal minority in the state), but perhaps being tied to child genocide will finally push the turtle out of office.","60,000 child migrants detained by US in last 40 days","","https://www.bbc.com/news/av/world-us-canada-48602222/60000-child-migrants-detained-by-us-in-last-40-days?fbclid=IwAR3ubKECRlX4wRPsDJy3XaleEQLCugnVM2O4k8BwUNLSLP_igW2FocAVhZU","bbc.com","https://www.reddit.com/r/politics/comments/c4xi7j/60000_child_migrants_detained_by_us_in_last_40/?ref=search_posts"
7,"2_1_1_1_1_1","24-06-19","25-06-19",511,"politics",0.97,4225,"real--life","BoringEvening9",43,0,"That would be nice, but I wish that there was something nonviolent we could do to Trump to get him out of office before January 2021.  McConnell won't ever move on removing Trump.","60,000 child migrants detained by US in last 40 days","","https://www.bbc.com/news/av/world-us-canada-48602222/60000-child-migrants-detained-by-us-in-last-40-days?fbclid=IwAR3ubKECRlX4wRPsDJy3XaleEQLCugnVM2O4k8BwUNLSLP_igW2FocAVhZU","bbc.com","https://www.reddit.com/r/politics/comments/c4xi7j/60000_child_migrants_detained_by_us_in_last_40/?ref=search_posts"
8,"2_1_1_1_1_1_1","24-06-19","25-06-19",511,"politics",0.97,4225,"real--life","ThreeTimesUp",39,0,"&gt; *... but I wish that there was something nonviolent we could do to Trump to get him out of office...*

Pray for the Angel of Death to visit him to have a frank discussion of his dietary habits?","60,000 child migrants detained by US in last 40 days","","https://www.bbc.com/news/av/world-us-canada-48602222/60000-child-migrants-detained-by-us-in-last-40-days?fbclid=IwAR3ubKECRlX4wRPsDJy3XaleEQLCugnVM2O4k8BwUNLSLP_igW2FocAVhZU","bbc.com","https://www.reddit.com/r/politics/comments/c4xi7j/60000_child_migrants_detained_by_us_in_last_40/?ref=search_posts"
9,"2_1_1_1_1_1_1_1","24-06-19","25-06-19",511,"politics",0.97,4225,"real--life","nedonedonedo",15,0,"pence would do the same thing","60,000 child migrants detained by US in last 40 days","","https://www.bbc.com/news/av/world-us-canada-48602222/60000-child-migrants-detained-by-us-in-last-40-days?fbclid=IwAR3ubKECRlX4wRPsDJy3XaleEQLCugnVM2O4k8BwUNLSLP_igW2FocAVhZU","bbc.com","https://www.reddit.com/r/politics/comments/c4xi7j/60000_child_migrants_detained_by_us_in_last_40/?ref=search_posts"
10,"2_1_1_1_1_1_1_1_1","24-06-19","25-06-19",511,"politics",0.97,4225,"real--life","Haikuna__Matata",15,0,"He'd make them all Christian conversion camps.","60,000 child migrants detained by US in last 40 days","","https://www.bbc.com/news/av/world-us-canada-48602222/60000-child-migrants-detained-by-us-in-last-40-days?fbclid=IwAR3ubKECRlX4wRPsDJy3XaleEQLCugnVM2O4k8BwUNLSLP_igW2FocAVhZU","bbc.com","https://www.reddit.com/r/politics/comments/c4xi7j/60000_child_migrants_detained_by_us_in_last_40/?ref=search_posts"
11,"2_1_1_1_1_1_1_1_1_1","24-06-19","25-06-19",511,"politics",0.97,4225,"real--life","grammar_nazi_zombie",13,0,"""sir, they're children from largely Catholic countries.""

""Exactly. Make them Christians.""","60,000 child migrants detained by US in last 40 days","","https://www.bbc.com/news/av/world-us-canada-48602222/60000-child-migrants-detained-by-us-in-last-40-days?fbclid=IwAR3ubKECRlX4wRPsDJy3XaleEQLCugnVM2O4k8BwUNLSLP_igW2FocAVhZU","bbc.com","https://www.reddit.com/r/politics/comments/c4xi7j/60000_child_migrants_detained_by_us_in_last_40/?ref=search_posts"
12,"2_1_1_1_1_1_1_1_2","24-06-19","25-06-19",511,"politics",0.97,4225,"real--life","jwords",3,0,"That I doubt. I think he's clever enough to use it as an opportunity to distance Evangelicals from Trump by saving the children ""the other guy"" put in camps.","60,000 child migrants detained by US in last 40 days","","https://www.bbc.com/news/av/world-us-canada-48602222/60000-child-migrants-detained-by-us-in-last-40-days?fbclid=IwAR3ubKECRlX4wRPsDJy3XaleEQLCugnVM2O4k8BwUNLSLP_igW2FocAVhZU","bbc.com","https://www.reddit.com/r/politics/comments/c4xi7j/60000_child_migrants_detained_by_us_in_last_40/?ref=search_posts"
13,"2_1_1_1_1_1_1_1_3","24-06-19","25-06-19",511,"politics",0.97,4225,"real--life","Brannagain",4,0,"I doubt he'd be able to command the Trump Horde though","60,000 child migrants detained by US in last 40 days","","https://www.bbc.com/news/av/world-us-canada-48602222/60000-child-migrants-detained-by-us-in-last-40-days?fbclid=IwAR3ubKECRlX4wRPsDJy3XaleEQLCugnVM2O4k8BwUNLSLP_igW2FocAVhZU","bbc.com","https://www.reddit.com/r/politics/comments/c4xi7j/60000_child_migrants_detained_by_us_in_last_40/?ref=search_posts"
14,"2_1_1_1_1_1_1_2","24-06-19","25-06-19",511,"politics",0.97,4225,"real--life","[deleted]",2,0,"Dark angel, please summon Mason Verger back to the abysmal pits of hell.","60,000 child migrants detained by US in last 40 days","","https://www.bbc.com/news/av/world-us-canada-48602222/60000-child-migrants-detained-by-us-in-last-40-days?fbclid=IwAR3ubKECRlX4wRPsDJy3XaleEQLCugnVM2O4k8BwUNLSLP_igW2FocAVhZU","bbc.com","https://www.reddit.com/r/politics/comments/c4xi7j/60000_child_migrants_detained_by_us_in_last_40/?ref=search_posts"
15,"2_1_1_1_1_1_1_3","24-06-19","25-06-19",511,"politics",0.97,4225,"real--life","pizzabyAlfredo",2,0,"if only there was amendment to the constitution that allowed citizens to overthrow a corrupt government.....","60,000 child migrants detained by US in last 40 days","","https://www.bbc.com/news/av/world-us-canada-48602222/60000-child-migrants-detained-by-us-in-last-40-days?fbclid=IwAR3ubKECRlX4wRPsDJy3XaleEQLCugnVM2O4k8BwUNLSLP_igW2FocAVhZU","bbc.com","https://www.reddit.com/r/politics/comments/c4xi7j/60000_child_migrants_detained_by_us_in_last_40/?ref=search_posts"
16,"2_1_1_1_1_1_2","24-06-19","25-06-19",511,"politics",0.97,4225,"real--life","jedre",9,0,"Urge Republican Senators to vote for a new majority leader. They could replace him at any time. 

This makes them every bit as guilty of all the things attributed to Mitch.","60,000 child migrants detained by US in last 40 days","","https://www.bbc.com/news/av/world-us-canada-48602222/60000-child-migrants-detained-by-us-in-last-40-days?fbclid=IwAR3ubKECRlX4wRPsDJy3XaleEQLCugnVM2O4k8BwUNLSLP_igW2FocAVhZU","bbc.com","https://www.reddit.com/r/politics/comments/c4xi7j/60000_child_migrants_detained_by_us_in_last_40/?ref=search_posts"
17,"2_1_1_1_1_1_3","24-06-19","25-06-19",511,"politics",0.97,4225,"real--life","KalashnaCough",20,0,"At the very least we need to get McConnell and the other 21 GOP Senators up for election next year up front on not only the issue of impeachment, but the issue of concentration camps and child torture on the Southern border.

Times like this I wish we *actually* had a liberal media that was willing to call these fascists out for their shit, not fuckers like Chuck Todd. Somebody sure as hell needs to shine a light on the madness enveloping this nation.","60,000 child migrants detained by US in last 40 days","","https://www.bbc.com/news/av/world-us-canada-48602222/60000-child-migrants-detained-by-us-in-last-40-days?fbclid=IwAR3ubKECRlX4wRPsDJy3XaleEQLCugnVM2O4k8BwUNLSLP_igW2FocAVhZU","bbc.com","https://www.reddit.com/r/politics/comments/c4xi7j/60000_child_migrants_detained_by_us_in_last_40/?ref=search_posts"
18,"2_1_1_1_1_1_3_1","24-06-19","25-06-19",511,"politics",0.97,4225,"real--life","BreakingGaia",7,0,"&gt;I wish we actually had a liberal media that was willing to call these fascists out for their shit...

We need to found something like this ourselves. 

All major media outlets are owned by the billionaire class. We will only ever know what they want us to hear. The liberal media was just as in favor of trump as they were Clinton. And now, they're pushing Biden because he will still let the Republicans do as they please. They did not want Obama and they sure as hell don't want this new wave of ""socialists"". They like Dems that will work across the aisle because then the status quo is still in their favor, but they appear to be supporting progress...at a trickle rate.","60,000 child migrants detained by US in last 40 days","","https://www.bbc.com/news/av/world-us-canada-48602222/60000-child-migrants-detained-by-us-in-last-40-days?fbclid=IwAR3ubKECRlX4wRPsDJy3XaleEQLCugnVM2O4k8BwUNLSLP_igW2FocAVhZU","bbc.com","https://www.reddit.com/r/politics/comments/c4xi7j/60000_child_migrants_detained_by_us_in_last_40/?ref=search_posts"
19,"2_1_1_1_1_1_4","24-06-19","25-06-19",511,"politics",0.97,4225,"real--life","jacksclasshatred",1,0,"http://www.bbc.com/future/story/20190513-it-only-takes-35-of-people-to-change-the-world","60,000 child migrants detained by US in last 40 days","","https://www.bbc.com/news/av/world-us-canada-48602222/60000-child-migrants-detained-by-us-in-last-40-days?fbclid=IwAR3ubKECRlX4wRPsDJy3XaleEQLCugnVM2O4k8BwUNLSLP_igW2FocAVhZU","bbc.com","https://www.reddit.com/r/politics/comments/c4xi7j/60000_child_migrants_detained_by_us_in_last_40/?ref=search_posts"
20,"2_1_1_1_1_1_5","24-06-19","25-06-19",511,"politics",0.97,4225,"real--life","butter_fat",1,0,"You think trump is just going to leave office even if he is voted out? Sounds like wishful thinking to me. I bet trump kicks off a civil war the moment he is shown the door.","60,000 child migrants detained by US in last 40 days","","https://www.bbc.com/news/av/world-us-canada-48602222/60000-child-migrants-detained-by-us-in-last-40-days?fbclid=IwAR3ubKECRlX4wRPsDJy3XaleEQLCugnVM2O4k8BwUNLSLP_igW2FocAVhZU","bbc.com","https://www.reddit.com/r/politics/comments/c4xi7j/60000_child_migrants_detained_by_us_in_last_40/?ref=search_posts"
21,"2_1_1_1_1_2","24-06-19","25-06-19",511,"politics",0.97,4225,"real--life","Anger_Mgmt_issues",16,0,"we don't have to remove him. Just his power. Flip the Senate, and he is minority leader. A position he himself ensured has no power whatsoever.","60,000 child migrants detained by US in last 40 days","","https://www.bbc.com/news/av/world-us-canada-48602222/60000-child-migrants-detained-by-us-in-last-40-days?fbclid=IwAR3ubKECRlX4wRPsDJy3XaleEQLCugnVM2O4k8BwUNLSLP_igW2FocAVhZU","bbc.com","https://www.reddit.com/r/politics/comments/c4xi7j/60000_child_migrants_detained_by_us_in_last_40/?ref=search_posts"
22,"2_1_1_1_1_2_1","24-06-19","25-06-19",511,"politics",0.97,4225,"real--life","[deleted]",2,0,"[deleted]","60,000 child migrants detained by US in last 40 days","","https://www.bbc.com/news/av/world-us-canada-48602222/60000-child-migrants-detained-by-us-in-last-40-days?fbclid=IwAR3ubKECRlX4wRPsDJy3XaleEQLCugnVM2O4k8BwUNLSLP_igW2FocAVhZU","bbc.com","https://www.reddit.com/r/politics/comments/c4xi7j/60000_child_migrants_detained_by_us_in_last_40/?ref=search_posts"
23,"2_1_1_1_1_2_1_1","24-06-19","25-06-19",511,"politics",0.97,4225,"real--life","Th3Seconds1st",10,0,"So we nuke the filibuster, make D.C. and Puerto Rico states, expand the House of Reps. stack the SCOTUS, pass all the bills they've shot down and let them they started this shit.","60,000 child migrants detained by US in last 40 days","","https://www.bbc.com/news/av/world-us-canada-48602222/60000-child-migrants-detained-by-us-in-last-40-days?fbclid=IwAR3ubKECRlX4wRPsDJy3XaleEQLCugnVM2O4k8BwUNLSLP_igW2FocAVhZU","bbc.com","https://www.reddit.com/r/politics/comments/c4xi7j/60000_child_migrants_detained_by_us_in_last_40/?ref=search_posts"
24,"2_1_1_1_1_2_1_1_1","24-06-19","25-06-19",511,"politics",0.97,4225,"real--life","[deleted]",0,0,"[deleted]","60,000 child migrants detained by US in last 40 days","","https://www.bbc.com/news/av/world-us-canada-48602222/60000-child-migrants-detained-by-us-in-last-40-days?fbclid=IwAR3ubKECRlX4wRPsDJy3XaleEQLCugnVM2O4k8BwUNLSLP_igW2FocAVhZU","bbc.com","https://www.reddit.com/r/politics/comments/c4xi7j/60000_child_migrants_detained_by_us_in_last_40/?ref=search_posts"
25,"2_1_1_1_1_2_1_1_1_1","24-06-19","25-06-19",511,"politics",0.97,4225,"real--life","TracerFromOW",10,0,"Who cares wtf republicans use as a PR. Justice &gt;&gt; some stupid fucking norms that republicans break anyways.","60,000 child migrants detained by US in last 40 days","","https://www.bbc.com/news/av/world-us-canada-48602222/60000-child-migrants-detained-by-us-in-last-40-days?fbclid=IwAR3ubKECRlX4wRPsDJy3XaleEQLCugnVM2O4k8BwUNLSLP_igW2FocAVhZU","bbc.com","https://www.reddit.com/r/politics/comments/c4xi7j/60000_child_migrants_detained_by_us_in_last_40/?ref=search_posts"
26,"2_1_1_1_1_2_1_1_1_2","24-06-19","25-06-19",511,"politics",0.97,4225,"real--life","chowderbags",3,0,"DC is very wealthy, though not very well distributed.

Puerto Rico has a lot of problems stemming from neglect.","60,000 child migrants detained by US in last 40 days","","https://www.bbc.com/news/av/world-us-canada-48602222/60000-child-migrants-detained-by-us-in-last-40-days?fbclid=IwAR3ubKECRlX4wRPsDJy3XaleEQLCugnVM2O4k8BwUNLSLP_igW2FocAVhZU","bbc.com","https://www.reddit.com/r/politics/comments/c4xi7j/60000_child_migrants_detained_by_us_in_last_40/?ref=search_posts"
27,"2_1_1_1_1_3","24-06-19","25-06-19",511,"politics",0.97,4225,"real--life","[deleted]",6,0,"His voters don't see them as children, or even people for that matter.  It's like how Nazis looked at Jews as a pest or a scourge.  Those Republican voters who want to be seen as caring tisk about how those poor kids wouldn't be in this mess if their parents had just stayed home.  It's willful ignorance and it should be publicly shamed as much as possible","60,000 child migrants detained by US in last 40 days","","https://www.bbc.com/news/av/world-us-canada-48602222/60000-child-migrants-detained-by-us-in-last-40-days?fbclid=IwAR3ubKECRlX4wRPsDJy3XaleEQLCugnVM2O4k8BwUNLSLP_igW2FocAVhZU","bbc.com","https://www.reddit.com/r/politics/comments/c4xi7j/60000_child_migrants_detained_by_us_in_last_40/?ref=search_posts"
28,"2_1_1_1_1_4","24-06-19","25-06-19",511,"politics",0.97,4225,"real--life","Vynl_jnky",1,0,"What if we called them Christian refugees would that wake up the Mitch?","60,000 child migrants detained by US in last 40 days","","https://www.bbc.com/news/av/world-us-canada-48602222/60000-child-migrants-detained-by-us-in-last-40-days?fbclid=IwAR3ubKECRlX4wRPsDJy3XaleEQLCugnVM2O4k8BwUNLSLP_igW2FocAVhZU","bbc.com","https://www.reddit.com/r/politics/comments/c4xi7j/60000_child_migrants_detained_by_us_in_last_40/?ref=search_posts"
29,"2_1_1_1_1_5","24-06-19","25-06-19",511,"politics",0.97,4225,"real--life","markca",1,0,"Nah, his base loves the idea of incarcerating brown kids.","60,000 child migrants detained by US in last 40 days","","https://www.bbc.com/news/av/world-us-canada-48602222/60000-child-migrants-detained-by-us-in-last-40-days?fbclid=IwAR3ubKECRlX4wRPsDJy3XaleEQLCugnVM2O4k8BwUNLSLP_igW2FocAVhZU","bbc.com","https://www.reddit.com/r/politics/comments/c4xi7j/60000_child_migrants_detained_by_us_in_last_40/?ref=search_posts"
30,"2_1_1_1_2","24-06-19","25-06-19",511,"politics",0.97,4225,"real--life","Riaayo",4,0,"Impeach. Use impeachment as a political bludgeon. McConnell can not care all he wants while Democrats expose Trump's criminality and run against Republicans who do nothing about it.","60,000 child migrants detained by US in last 40 days","","https://www.bbc.com/news/av/world-us-canada-48602222/60000-child-migrants-detained-by-us-in-last-40-days?fbclid=IwAR3ubKECRlX4wRPsDJy3XaleEQLCugnVM2O4k8BwUNLSLP_igW2FocAVhZU","bbc.com","https://www.reddit.com/r/politics/comments/c4xi7j/60000_child_migrants_detained_by_us_in_last_40/?ref=search_posts"
31,"2_1_1_1_3","24-06-19","25-06-19",511,"politics",0.97,4225,"real--life","RedBeans-n-Ricely",3,0,"The fact he hasnt been struck down by a lightening bolt is proof there is no god.","60,000 child migrants detained by US in last 40 days","","https://www.bbc.com/news/av/world-us-canada-48602222/60000-child-migrants-detained-by-us-in-last-40-days?fbclid=IwAR3ubKECRlX4wRPsDJy3XaleEQLCugnVM2O4k8BwUNLSLP_igW2FocAVhZU","bbc.com","https://www.reddit.com/r/politics/comments/c4xi7j/60000_child_migrants_detained_by_us_in_last_40/?ref=search_posts"
32,"2_1_1_1_4","24-06-19","25-06-19",511,"politics",0.97,4225,"real--life","hydrocarbonsRus",3,0,"Why are we trying to predict the future? Air all the dirty laundry- launch a full fledge impeachment inquiry- prosecute those obstructing the investigation to the fullest extent of the law, and stop with these bullshit subpoena and contempt threats. Just do it already- let the people decide after presenting the evidence in a public forum for all to see. Then see if the senate still doesnt vote on this despite the overwhelming public testimonies and evidence. We need to stop predicting the future and justify our inaction through that- it only helps Trump. Show the administration that the house means business and stop with the bullshit theatricals.","60,000 child migrants detained by US in last 40 days","","https://www.bbc.com/news/av/world-us-canada-48602222/60000-child-migrants-detained-by-us-in-last-40-days?fbclid=IwAR3ubKECRlX4wRPsDJy3XaleEQLCugnVM2O4k8BwUNLSLP_igW2FocAVhZU","bbc.com","https://www.reddit.com/r/politics/comments/c4xi7j/60000_child_migrants_detained_by_us_in_last_40/?ref=search_posts"
33,"2_1_1_1_5","24-06-19","25-06-19",511,"politics",0.97,4225,"real--life","Antique_futurist",4,0,"Impeach him for 60,000 counts of child abuse and child neglect.

The Republicans can choose to either vote to impeach or give the sound clips defending their votes that will end their careers.","60,000 child migrants detained by US in last 40 days","","https://www.bbc.com/news/av/world-us-canada-48602222/60000-child-migrants-detained-by-us-in-last-40-days?fbclid=IwAR3ubKECRlX4wRPsDJy3XaleEQLCugnVM2O4k8BwUNLSLP_igW2FocAVhZU","bbc.com","https://www.reddit.com/r/politics/comments/c4xi7j/60000_child_migrants_detained_by_us_in_last_40/?ref=search_posts"
34,"2_1_1_2","24-06-19","25-06-19",511,"politics",0.97,4225,"real--life","Theantsdisagree",16,0,"Impeaching trump wont stop the flux of migrants but it may secure more humane conditions for them. Major economies need to stop taking advantage of developing nations if this shit is ever going to stop.","60,000 child migrants detained by US in last 40 days","","https://www.bbc.com/news/av/world-us-canada-48602222/60000-child-migrants-detained-by-us-in-last-40-days?fbclid=IwAR3ubKECRlX4wRPsDJy3XaleEQLCugnVM2O4k8BwUNLSLP_igW2FocAVhZU","bbc.com","https://www.reddit.com/r/politics/comments/c4xi7j/60000_child_migrants_detained_by_us_in_last_40/?ref=search_posts"
35,"2_1_1_2_1","24-06-19","25-06-19",511,"politics",0.97,4225,"real--life","[deleted]",32,0,"Migrants are not the problem, just as blacks werent the problem 60 years ago.  Its the damn wealthy elite continuously pointing easily manipulated conservatives at brown people so theres less chances the lower and middle classes will unite and rise up against them.  The true reason people are miserable is the wealthy elite hoarding our futures prosperity...plain and simple.  Want to see things improve immediately in this country?  Tax the rich proportional to their assets.  Use that money to fix the states the rich bled dry or left for dead.","60,000 child migrants detained by US in last 40 days","","https://www.bbc.com/news/av/world-us-canada-48602222/60000-child-migrants-detained-by-us-in-last-40-days?fbclid=IwAR3ubKECRlX4wRPsDJy3XaleEQLCugnVM2O4k8BwUNLSLP_igW2FocAVhZU","bbc.com","https://www.reddit.com/r/politics/comments/c4xi7j/60000_child_migrants_detained_by_us_in_last_40/?ref=search_posts"
36,"2_1_1_2_1_1","24-06-19","25-06-19",511,"politics",0.97,4225,"real--life","SoulInMyShadow",1,0,"And our own government waste is an [issue](https://www.forbes.com/sites/kotlikoff/2017/12/08/has-our-government-spent-21-trillion-of-our-money-without-telling-us/).","60,000 child migrants detained by US in last 40 days","","https://www.bbc.com/news/av/world-us-canada-48602222/60000-child-migrants-detained-by-us-in-last-40-days?fbclid=IwAR3ubKECRlX4wRPsDJy3XaleEQLCugnVM2O4k8BwUNLSLP_igW2FocAVhZU","bbc.com","https://www.reddit.com/r/politics/comments/c4xi7j/60000_child_migrants_detained_by_us_in_last_40/?ref=search_posts"
37,"2_1_1_2_2","24-06-19","25-06-19",511,"politics",0.97,4225,"real--life","KalashnaCough",7,0,"Good point. I just find it hard to accept as the wealthiest nation on the planet that we have to force this people to be in these conditions. The families certainly don't need to be broken apart.

Then again, I already know that this is all happening on purpose, the way they (Trump et al) want it to be happening.","60,000 child migrants detained by US in last 40 days","","https://www.bbc.com/news/av/world-us-canada-48602222/60000-child-migrants-detained-by-us-in-last-40-days?fbclid=IwAR3ubKECRlX4wRPsDJy3XaleEQLCugnVM2O4k8BwUNLSLP_igW2FocAVhZU","bbc.com","https://www.reddit.com/r/politics/comments/c4xi7j/60000_child_migrants_detained_by_us_in_last_40/?ref=search_posts"
38,"2_1_1_3","24-06-19","25-06-19",511,"politics",0.97,4225,"real--life","[deleted]",1,0,"[deleted]","60,000 child migrants detained by US in last 40 days","","https://www.bbc.com/news/av/world-us-canada-48602222/60000-child-migrants-detained-by-us-in-last-40-days?fbclid=IwAR3ubKECRlX4wRPsDJy3XaleEQLCugnVM2O4k8BwUNLSLP_igW2FocAVhZU","bbc.com","https://www.reddit.com/r/politics/comments/c4xi7j/60000_child_migrants_detained_by_us_in_last_40/?ref=search_posts"
39,"2_1_1_3_1","24-06-19","25-06-19",511,"politics",0.97,4225,"real--life","thelastcookie",0,0,"Hey, she needs those kids to suffer until 2020. How else is her buddy Biden going to appease centrists and still get minority votes?","60,000 child migrants detained by US in last 40 days","","https://www.bbc.com/news/av/world-us-canada-48602222/60000-child-migrants-detained-by-us-in-last-40-days?fbclid=IwAR3ubKECRlX4wRPsDJy3XaleEQLCugnVM2O4k8BwUNLSLP_igW2FocAVhZU","bbc.com","https://www.reddit.com/r/politics/comments/c4xi7j/60000_child_migrants_detained_by_us_in_last_40/?ref=search_posts"
