"id","structure","post_date","comm_date","num_comments","subreddit","upvote_prop","post_score","author","user","comment_score","controversiality","comment","title","post_text","link","domain","URL"
211,"5_1","24-06-19","25-06-19",511,"politics",0.97,4225,"real--life","ViatorA01",17,0,"And Betsy DeVos profits from children getting separated [here](https://www.google.com/amp/s/mavenroundtable.io/theintellectualist/api/amp/theintellectualist/news/migrant-children-are-being-given-to-an-adoption-agency-linked-to-betsy-devos-9j_wI0EkdEuS55b6qnzwsA/)","60,000 child migrants detained by US in last 40 days","","https://www.bbc.com/news/av/world-us-canada-48602222/60000-child-migrants-detained-by-us-in-last-40-days?fbclid=IwAR3ubKECRlX4wRPsDJy3XaleEQLCugnVM2O4k8BwUNLSLP_igW2FocAVhZU","bbc.com","https://www.reddit.com/r/politics/comments/c4xi7j/60000_child_migrants_detained_by_us_in_last_40/?ref=search_posts"
212,"5_2","24-06-19","25-06-19",511,"politics",0.97,4225,"real--life","thijser2",6,0,"And that they are paying 750 dollar per child per day and yet somehow don't have the funding to pay for toothpaste.","60,000 child migrants detained by US in last 40 days","","https://www.bbc.com/news/av/world-us-canada-48602222/60000-child-migrants-detained-by-us-in-last-40-days?fbclid=IwAR3ubKECRlX4wRPsDJy3XaleEQLCugnVM2O4k8BwUNLSLP_igW2FocAVhZU","bbc.com","https://www.reddit.com/r/politics/comments/c4xi7j/60000_child_migrants_detained_by_us_in_last_40/?ref=search_posts"
213,"5_3","24-06-19","25-06-19",511,"politics",0.97,4225,"real--life","[deleted]",2,0,"[deleted]","60,000 child migrants detained by US in last 40 days","","https://www.bbc.com/news/av/world-us-canada-48602222/60000-child-migrants-detained-by-us-in-last-40-days?fbclid=IwAR3ubKECRlX4wRPsDJy3XaleEQLCugnVM2O4k8BwUNLSLP_igW2FocAVhZU","bbc.com","https://www.reddit.com/r/politics/comments/c4xi7j/60000_child_migrants_detained_by_us_in_last_40/?ref=search_posts"
214,"5_3_1","24-06-19","25-06-19",511,"politics",0.97,4225,"real--life","TomPuck15",5,0,"I dont have a source for OP, but [John Kelly joined the board of a company that is running one of the detention centers in Florida](https://www.businessinsider.com/john-kelly-new-role-will-profit-from-child-separation-policy-2019-5)

I always assumed when he got fed up with the craziness he would quit and spill the beans on the disfunction in the White House. Turns out, like every other republican his morals were just for sale to the highest bidder.","60,000 child migrants detained by US in last 40 days","","https://www.bbc.com/news/av/world-us-canada-48602222/60000-child-migrants-detained-by-us-in-last-40-days?fbclid=IwAR3ubKECRlX4wRPsDJy3XaleEQLCugnVM2O4k8BwUNLSLP_igW2FocAVhZU","bbc.com","https://www.reddit.com/r/politics/comments/c4xi7j/60000_child_migrants_detained_by_us_in_last_40/?ref=search_posts"
215,"6","24-06-19","25-06-19",511,"politics",0.97,4225,"real--life","StrongChemical",20,0,"This is absolutely unsustainable.","60,000 child migrants detained by US in last 40 days","","https://www.bbc.com/news/av/world-us-canada-48602222/60000-child-migrants-detained-by-us-in-last-40-days?fbclid=IwAR3ubKECRlX4wRPsDJy3XaleEQLCugnVM2O4k8BwUNLSLP_igW2FocAVhZU","bbc.com","https://www.reddit.com/r/politics/comments/c4xi7j/60000_child_migrants_detained_by_us_in_last_40/?ref=search_posts"
216,"7","24-06-19","24-06-19",511,"politics",0.97,4225,"real--life","detten17",44,0,"God damn. Shit is going tits up in Central America.","60,000 child migrants detained by US in last 40 days","","https://www.bbc.com/news/av/world-us-canada-48602222/60000-child-migrants-detained-by-us-in-last-40-days?fbclid=IwAR3ubKECRlX4wRPsDJy3XaleEQLCugnVM2O4k8BwUNLSLP_igW2FocAVhZU","bbc.com","https://www.reddit.com/r/politics/comments/c4xi7j/60000_child_migrants_detained_by_us_in_last_40/?ref=search_posts"
217,"7_1","24-06-19","24-06-19",511,"politics",0.97,4225,"real--life","dy0nisus",18,0,"That number is staggering...to put it mildly.","60,000 child migrants detained by US in last 40 days","","https://www.bbc.com/news/av/world-us-canada-48602222/60000-child-migrants-detained-by-us-in-last-40-days?fbclid=IwAR3ubKECRlX4wRPsDJy3XaleEQLCugnVM2O4k8BwUNLSLP_igW2FocAVhZU","bbc.com","https://www.reddit.com/r/politics/comments/c4xi7j/60000_child_migrants_detained_by_us_in_last_40/?ref=search_posts"
218,"7_1_1","24-06-19","25-06-19",511,"politics",0.97,4225,"real--life","HuevosSplash",43,0,"Wait in a few years when Climate Change really gets going, no walls are ever gonna stop the massive humanitarian crisis that we're heading towards. Americans are gonna be looking to migrate as well when crops start failing and all those rich Boomers lose their McMansions on the coasts.","60,000 child migrants detained by US in last 40 days","","https://www.bbc.com/news/av/world-us-canada-48602222/60000-child-migrants-detained-by-us-in-last-40-days?fbclid=IwAR3ubKECRlX4wRPsDJy3XaleEQLCugnVM2O4k8BwUNLSLP_igW2FocAVhZU","bbc.com","https://www.reddit.com/r/politics/comments/c4xi7j/60000_child_migrants_detained_by_us_in_last_40/?ref=search_posts"
219,"7_1_1_1","24-06-19","25-06-19",511,"politics",0.97,4225,"real--life","[deleted]",18,0,"[deleted]","60,000 child migrants detained by US in last 40 days","","https://www.bbc.com/news/av/world-us-canada-48602222/60000-child-migrants-detained-by-us-in-last-40-days?fbclid=IwAR3ubKECRlX4wRPsDJy3XaleEQLCugnVM2O4k8BwUNLSLP_igW2FocAVhZU","bbc.com","https://www.reddit.com/r/politics/comments/c4xi7j/60000_child_migrants_detained_by_us_in_last_40/?ref=search_posts"
220,"7_1_1_1_1","24-06-19","25-06-19",511,"politics",0.97,4225,"real--life","liberalmonkey",19,0,"For anyone who wants additional information, apparently Spring came late for most of Kansas and Oklahoma, leaving a huge shortage in corn, soy, sugar beets, and oats. While other areas like Ohio have received a larger than normal amount of rain/wind and thus made much of the land unusable. Only 1/3 of Ohio's farmland is in use this year. Apparently there will also be losses to berries, nuts, and peanuts as well. There will likely be huge increases in produce costs as the year goes on.

Sources:
http://strangesounds.org/2019/05/usa-food-crisis-food-prices-crops-agriculture.html

https://agroinsurance.com/en/usa-crops-in-2019-may-be-affected/","60,000 child migrants detained by US in last 40 days","","https://www.bbc.com/news/av/world-us-canada-48602222/60000-child-migrants-detained-by-us-in-last-40-days?fbclid=IwAR3ubKECRlX4wRPsDJy3XaleEQLCugnVM2O4k8BwUNLSLP_igW2FocAVhZU","bbc.com","https://www.reddit.com/r/politics/comments/c4xi7j/60000_child_migrants_detained_by_us_in_last_40/?ref=search_posts"
221,"7_1_1_1_1_1","24-06-19","25-06-19",511,"politics",0.97,4225,"real--life","[deleted]",1,0,"[deleted]","60,000 child migrants detained by US in last 40 days","","https://www.bbc.com/news/av/world-us-canada-48602222/60000-child-migrants-detained-by-us-in-last-40-days?fbclid=IwAR3ubKECRlX4wRPsDJy3XaleEQLCugnVM2O4k8BwUNLSLP_igW2FocAVhZU","bbc.com","https://www.reddit.com/r/politics/comments/c4xi7j/60000_child_migrants_detained_by_us_in_last_40/?ref=search_posts"
222,"7_1_1_1_1_1_1","24-06-19","26-06-19",511,"politics",0.97,4225,"real--life","liberalmonkey",1,0,"Likely. But many of them already get bailed out through government farm insurance.","60,000 child migrants detained by US in last 40 days","","https://www.bbc.com/news/av/world-us-canada-48602222/60000-child-migrants-detained-by-us-in-last-40-days?fbclid=IwAR3ubKECRlX4wRPsDJy3XaleEQLCugnVM2O4k8BwUNLSLP_igW2FocAVhZU","bbc.com","https://www.reddit.com/r/politics/comments/c4xi7j/60000_child_migrants_detained_by_us_in_last_40/?ref=search_posts"
223,"7_2","24-06-19","25-06-19",511,"politics",0.97,4225,"real--life","smick",7,0,"Be advised that many of these children are from familys in this country already. This is a roundup as well as a trap at the border. This is a crime against humanity. The United Nations needs to step in. The national guard should be deployed to rescue these children from these concentration camps.","60,000 child migrants detained by US in last 40 days","","https://www.bbc.com/news/av/world-us-canada-48602222/60000-child-migrants-detained-by-us-in-last-40-days?fbclid=IwAR3ubKECRlX4wRPsDJy3XaleEQLCugnVM2O4k8BwUNLSLP_igW2FocAVhZU","bbc.com","https://www.reddit.com/r/politics/comments/c4xi7j/60000_child_migrants_detained_by_us_in_last_40/?ref=search_posts"
224,"8","24-06-19","24-06-19",511,"politics",0.97,4225,"real--life","SafeSpaceGhost",85,0,"First they put them in Camps. Then they started rounding them up. Then They said they are moving them to ""better conditions"". Then they told the World nothing to see here. And they were believed. A World War and years later we found out what really happened.

Nazi Germany doesnt sound like Today? Its more than just concentration camps that are matching Hitlers Plan.","60,000 child migrants detained by US in last 40 days","","https://www.bbc.com/news/av/world-us-canada-48602222/60000-child-migrants-detained-by-us-in-last-40-days?fbclid=IwAR3ubKECRlX4wRPsDJy3XaleEQLCugnVM2O4k8BwUNLSLP_igW2FocAVhZU","bbc.com","https://www.reddit.com/r/politics/comments/c4xi7j/60000_child_migrants_detained_by_us_in_last_40/?ref=search_posts"
225,"8_1","24-06-19","25-06-19",511,"politics",0.97,4225,"real--life","DankMemeProfessor",1,0,"&gt;Then They said they are moving them to ""better conditions"".

I am assuming you're referring to this [https://news.yahoo.com/government-moves-migrant-kids-poor-171006601.html](https://news.yahoo.com/government-moves-migrant-kids-poor-171006601.html)

&gt;The U.S. government has removed most of the children from a remote  Border Patrol station in Texas following reports that more than 300  children were detained there, caring for each other with inadequate  food, water and sanitation.

This is where they are being moved to btw

&gt;**But Clara Long, an attorney who interviewed children at Border Patrol  Station 1 last week, said conditions were not necessarily better there.**  
&gt;  
&gt;**""One  boy I spoke with said his family didn't get mattresses or blankets for  the first two nights and he and his mom came down with a fever,"" said  Long, a senior researcher with Human Rights Watch. ""He said there were  no toothbrushes, and it was very, very cold.""**

[In El Paso, Border Patrol Is Detaining Migrants in a Human Dog Pound](https://www.texasmonthly.com/news/border-patrol-outdoor-detention-migrants-el-paso/)

[Migrants being held outdoors near bridge in El Paso, official says](https://www.cbsnews.com/news/paso-del-norte-bridge-el-paso-texas-migrants-being-held-outdoors-customs-and-border-patrol-official-says-2019-06-11/)

[When migrants are first detained, Cabrera said all go to Border Patrol Station 1, which is on the same property as the tent facility](https://cbs4local.com/news/local/border-patrol-working-on-processing-migrants-more-efficiently-at-northeast-tent-facility)","60,000 child migrants detained by US in last 40 days","","https://www.bbc.com/news/av/world-us-canada-48602222/60000-child-migrants-detained-by-us-in-last-40-days?fbclid=IwAR3ubKECRlX4wRPsDJy3XaleEQLCugnVM2O4k8BwUNLSLP_igW2FocAVhZU","bbc.com","https://www.reddit.com/r/politics/comments/c4xi7j/60000_child_migrants_detained_by_us_in_last_40/?ref=search_posts"
226,"8_2","24-06-19","25-06-19",511,"politics",0.97,4225,"real--life","[deleted]",-14,0,"[deleted]","60,000 child migrants detained by US in last 40 days","","https://www.bbc.com/news/av/world-us-canada-48602222/60000-child-migrants-detained-by-us-in-last-40-days?fbclid=IwAR3ubKECRlX4wRPsDJy3XaleEQLCugnVM2O4k8BwUNLSLP_igW2FocAVhZU","bbc.com","https://www.reddit.com/r/politics/comments/c4xi7j/60000_child_migrants_detained_by_us_in_last_40/?ref=search_posts"
227,"8_2_1","24-06-19","25-06-19",511,"politics",0.97,4225,"real--life","pegothejerk",23,0,"He's talking about Germany during the Nazi roundup of ""undesirables"", and how it sounds like today's ICE raids on work places, homes, schools, etc.","60,000 child migrants detained by US in last 40 days","","https://www.bbc.com/news/av/world-us-canada-48602222/60000-child-migrants-detained-by-us-in-last-40-days?fbclid=IwAR3ubKECRlX4wRPsDJy3XaleEQLCugnVM2O4k8BwUNLSLP_igW2FocAVhZU","bbc.com","https://www.reddit.com/r/politics/comments/c4xi7j/60000_child_migrants_detained_by_us_in_last_40/?ref=search_posts"
228,"8_2_1_1","24-06-19","25-06-19",511,"politics",0.97,4225,"real--life","ViatorA01",3,0,"Yeah but source. /s","60,000 child migrants detained by US in last 40 days","","https://www.bbc.com/news/av/world-us-canada-48602222/60000-child-migrants-detained-by-us-in-last-40-days?fbclid=IwAR3ubKECRlX4wRPsDJy3XaleEQLCugnVM2O4k8BwUNLSLP_igW2FocAVhZU","bbc.com","https://www.reddit.com/r/politics/comments/c4xi7j/60000_child_migrants_detained_by_us_in_last_40/?ref=search_posts"
229,"9","24-06-19","24-06-19",511,"politics",0.97,4225,"real--life","Akuna_My_Tatas",94,0,"We seriously need to be stopped. I don't care by who anymore.","60,000 child migrants detained by US in last 40 days","","https://www.bbc.com/news/av/world-us-canada-48602222/60000-child-migrants-detained-by-us-in-last-40-days?fbclid=IwAR3ubKECRlX4wRPsDJy3XaleEQLCugnVM2O4k8BwUNLSLP_igW2FocAVhZU","bbc.com","https://www.reddit.com/r/politics/comments/c4xi7j/60000_child_migrants_detained_by_us_in_last_40/?ref=search_posts"
230,"9_1","24-06-19","25-06-19",511,"politics",0.97,4225,"real--life","KalashnaCough",55,0,"Fucking for real. How do we get a UN intervention? At the very least we need to be sanctioned. This is fucking horrifying.","60,000 child migrants detained by US in last 40 days","","https://www.bbc.com/news/av/world-us-canada-48602222/60000-child-migrants-detained-by-us-in-last-40-days?fbclid=IwAR3ubKECRlX4wRPsDJy3XaleEQLCugnVM2O4k8BwUNLSLP_igW2FocAVhZU","bbc.com","https://www.reddit.com/r/politics/comments/c4xi7j/60000_child_migrants_detained_by_us_in_last_40/?ref=search_posts"
231,"9_1_1","24-06-19","25-06-19",511,"politics",0.97,4225,"real--life","kenbewdy8000",25,0,"The US is , conveniently , not a signatory to a number of international treaties and conventions.

The Geneva Convention is just one of them.

Guantanamo Bay is another example of this non participation in global human rights agreements.

The systematic mistreatment and exploitation of domestic convicts is also an international disgrace.","60,000 child migrants detained by US in last 40 days","","https://www.bbc.com/news/av/world-us-canada-48602222/60000-child-migrants-detained-by-us-in-last-40-days?fbclid=IwAR3ubKECRlX4wRPsDJy3XaleEQLCugnVM2O4k8BwUNLSLP_igW2FocAVhZU","bbc.com","https://www.reddit.com/r/politics/comments/c4xi7j/60000_child_migrants_detained_by_us_in_last_40/?ref=search_posts"
232,"9_1_2","24-06-19","25-06-19",511,"politics",0.97,4225,"real--life","thelastcookie",6,0,"&gt;  At the very least we need to be sanctioned. 

This not happening is how you know the rest of the world isn't much better.","60,000 child migrants detained by US in last 40 days","","https://www.bbc.com/news/av/world-us-canada-48602222/60000-child-migrants-detained-by-us-in-last-40-days?fbclid=IwAR3ubKECRlX4wRPsDJy3XaleEQLCugnVM2O4k8BwUNLSLP_igW2FocAVhZU","bbc.com","https://www.reddit.com/r/politics/comments/c4xi7j/60000_child_migrants_detained_by_us_in_last_40/?ref=search_posts"
233,"9_1_3","24-06-19","25-06-19",511,"politics",0.97,4225,"real--life","JanetYellensFuckboy",2,0,"We're on the UN Security Council.","60,000 child migrants detained by US in last 40 days","","https://www.bbc.com/news/av/world-us-canada-48602222/60000-child-migrants-detained-by-us-in-last-40-days?fbclid=IwAR3ubKECRlX4wRPsDJy3XaleEQLCugnVM2O4k8BwUNLSLP_igW2FocAVhZU","bbc.com","https://www.reddit.com/r/politics/comments/c4xi7j/60000_child_migrants_detained_by_us_in_last_40/?ref=search_posts"
234,"9_1_4","24-06-19","25-06-19",511,"politics",0.97,4225,"real--life","bigbrycm",3,0,"The UN is toothless","60,000 child migrants detained by US in last 40 days","","https://www.bbc.com/news/av/world-us-canada-48602222/60000-child-migrants-detained-by-us-in-last-40-days?fbclid=IwAR3ubKECRlX4wRPsDJy3XaleEQLCugnVM2O4k8BwUNLSLP_igW2FocAVhZU","bbc.com","https://www.reddit.com/r/politics/comments/c4xi7j/60000_child_migrants_detained_by_us_in_last_40/?ref=search_posts"
235,"9_1_5","24-06-19","25-06-19",511,"politics",0.97,4225,"real--life","JerHat",1,0,"UN, you got a problem with that? Know what you should do? Sanction me, sanction me with your army. OH! Wait a minute! You dont have an army! Guess that means you ought to shut the fuck up!

-Dave Chappelle, also probably the Trump administration.

I miss when things like this could just be funny.","60,000 child migrants detained by US in last 40 days","","https://www.bbc.com/news/av/world-us-canada-48602222/60000-child-migrants-detained-by-us-in-last-40-days?fbclid=IwAR3ubKECRlX4wRPsDJy3XaleEQLCugnVM2O4k8BwUNLSLP_igW2FocAVhZU","bbc.com","https://www.reddit.com/r/politics/comments/c4xi7j/60000_child_migrants_detained_by_us_in_last_40/?ref=search_posts"
236,"9_1_6","24-06-19","25-06-19",511,"politics",0.97,4225,"real--life","philmoeslim",1,0,"&amp;#x200B;

Solid username","60,000 child migrants detained by US in last 40 days","","https://www.bbc.com/news/av/world-us-canada-48602222/60000-child-migrants-detained-by-us-in-last-40-days?fbclid=IwAR3ubKECRlX4wRPsDJy3XaleEQLCugnVM2O4k8BwUNLSLP_igW2FocAVhZU","bbc.com","https://www.reddit.com/r/politics/comments/c4xi7j/60000_child_migrants_detained_by_us_in_last_40/?ref=search_posts"
237,"9_2","24-06-19","25-06-19",511,"politics",0.97,4225,"real--life","justahumaninny",7,0,"occupy washington dc idk why this hasnt happened yet..","60,000 child migrants detained by US in last 40 days","","https://www.bbc.com/news/av/world-us-canada-48602222/60000-child-migrants-detained-by-us-in-last-40-days?fbclid=IwAR3ubKECRlX4wRPsDJy3XaleEQLCugnVM2O4k8BwUNLSLP_igW2FocAVhZU","bbc.com","https://www.reddit.com/r/politics/comments/c4xi7j/60000_child_migrants_detained_by_us_in_last_40/?ref=search_posts"
238,"9_3","24-06-19","25-06-19",511,"politics",0.97,4225,"real--life","TheLightningbolt",8,0,"At this point there are only two ways to stop this:  massive nationwide strikes and protests that block roads, or a coup by the military.  Congress can't do shit because the republicans will block everything in the Senate.  No foreign nation will do anything because their economies depend on the US.","60,000 child migrants detained by US in last 40 days","","https://www.bbc.com/news/av/world-us-canada-48602222/60000-child-migrants-detained-by-us-in-last-40-days?fbclid=IwAR3ubKECRlX4wRPsDJy3XaleEQLCugnVM2O4k8BwUNLSLP_igW2FocAVhZU","bbc.com","https://www.reddit.com/r/politics/comments/c4xi7j/60000_child_migrants_detained_by_us_in_last_40/?ref=search_posts"
239,"9_3_1","24-06-19","25-06-19",511,"politics",0.97,4225,"real--life","wegschiss",-1,0,"Do you even realise how insane you sound? lmao","60,000 child migrants detained by US in last 40 days","","https://www.bbc.com/news/av/world-us-canada-48602222/60000-child-migrants-detained-by-us-in-last-40-days?fbclid=IwAR3ubKECRlX4wRPsDJy3XaleEQLCugnVM2O4k8BwUNLSLP_igW2FocAVhZU","bbc.com","https://www.reddit.com/r/politics/comments/c4xi7j/60000_child_migrants_detained_by_us_in_last_40/?ref=search_posts"
240,"9_3_1_1","24-06-19","25-06-19",511,"politics",0.97,4225,"real--life","TheLightningbolt",0,0,"What's insane is letting this fascist administration continue to be in power.  What other ways do you see of bringing this tyrant down?  Elections are a year and a half away.  This shit needs to be stopped NOW.","60,000 child migrants detained by US in last 40 days","","https://www.bbc.com/news/av/world-us-canada-48602222/60000-child-migrants-detained-by-us-in-last-40-days?fbclid=IwAR3ubKECRlX4wRPsDJy3XaleEQLCugnVM2O4k8BwUNLSLP_igW2FocAVhZU","bbc.com","https://www.reddit.com/r/politics/comments/c4xi7j/60000_child_migrants_detained_by_us_in_last_40/?ref=search_posts"
241,"9_3_1_1_1","24-06-19","25-06-19",511,"politics",0.97,4225,"real--life","wegschiss",0,0,"lol yeah he said bad words let's start a military coup lmao","60,000 child migrants detained by US in last 40 days","","https://www.bbc.com/news/av/world-us-canada-48602222/60000-child-migrants-detained-by-us-in-last-40-days?fbclid=IwAR3ubKECRlX4wRPsDJy3XaleEQLCugnVM2O4k8BwUNLSLP_igW2FocAVhZU","bbc.com","https://www.reddit.com/r/politics/comments/c4xi7j/60000_child_migrants_detained_by_us_in_last_40/?ref=search_posts"
242,"9_3_1_1_1_1","24-06-19","25-06-19",511,"politics",0.97,4225,"real--life","TheLightningbolt",1,0,"He's putting people in concentration camps, about to start a war, committing crimes like treason, obstruction of justice, bribery and more, bringing fascism into this country, attacking the press, inciting violence, etc.  He's a fucking nazi.","60,000 child migrants detained by US in last 40 days","","https://www.bbc.com/news/av/world-us-canada-48602222/60000-child-migrants-detained-by-us-in-last-40-days?fbclid=IwAR3ubKECRlX4wRPsDJy3XaleEQLCugnVM2O4k8BwUNLSLP_igW2FocAVhZU","bbc.com","https://www.reddit.com/r/politics/comments/c4xi7j/60000_child_migrants_detained_by_us_in_last_40/?ref=search_posts"
243,"9_3_1_1_1_1_1","24-06-19","26-06-19",511,"politics",0.97,4225,"real--life","wegschiss",0,0,"&gt; He's putting people in concentration camps 

Wrong

&gt;  about to start a war,  

Wrong

&gt; committing crimes like treason, obstruction of justice, bribery and more 

Wrong

&gt; bringing fascism into this country, 

Wrong

&gt;  attacking the press 

Self defense

&gt; inciting violence,  

Wrong

&gt; He's a fucking nazi. 

Wrong","60,000 child migrants detained by US in last 40 days","","https://www.bbc.com/news/av/world-us-canada-48602222/60000-child-migrants-detained-by-us-in-last-40-days?fbclid=IwAR3ubKECRlX4wRPsDJy3XaleEQLCugnVM2O4k8BwUNLSLP_igW2FocAVhZU","bbc.com","https://www.reddit.com/r/politics/comments/c4xi7j/60000_child_migrants_detained_by_us_in_last_40/?ref=search_posts"
244,"9_3_1_1_1_1_1_1","24-06-19","27-06-19",511,"politics",0.97,4225,"real--life","TheLightningbolt",1,0,"Wake up.  Stop watching faux news.  You need to learn what's really going on.","60,000 child migrants detained by US in last 40 days","","https://www.bbc.com/news/av/world-us-canada-48602222/60000-child-migrants-detained-by-us-in-last-40-days?fbclid=IwAR3ubKECRlX4wRPsDJy3XaleEQLCugnVM2O4k8BwUNLSLP_igW2FocAVhZU","bbc.com","https://www.reddit.com/r/politics/comments/c4xi7j/60000_child_migrants_detained_by_us_in_last_40/?ref=search_posts"
245,"9_4","24-06-19","25-06-19",511,"politics",0.97,4225,"real--life","2wedfgdfgfgfg",0,1,"So open borders now?","60,000 child migrants detained by US in last 40 days","","https://www.bbc.com/news/av/world-us-canada-48602222/60000-child-migrants-detained-by-us-in-last-40-days?fbclid=IwAR3ubKECRlX4wRPsDJy3XaleEQLCugnVM2O4k8BwUNLSLP_igW2FocAVhZU","bbc.com","https://www.reddit.com/r/politics/comments/c4xi7j/60000_child_migrants_detained_by_us_in_last_40/?ref=search_posts"
246,"10","24-06-19","24-06-19",511,"politics",0.97,4225,"real--life","real--life",139,0,"wonder how many outlets are sitting on hard evidence of legit death camps and mass graves refusing to run with it because it may upset the Republicans if they did

like they literally just admitted that they sandbagged Trump's most recent accuser because they didn't want to make a big deal out of it","60,000 child migrants detained by US in last 40 days","","https://www.bbc.com/news/av/world-us-canada-48602222/60000-child-migrants-detained-by-us-in-last-40-days?fbclid=IwAR3ubKECRlX4wRPsDJy3XaleEQLCugnVM2O4k8BwUNLSLP_igW2FocAVhZU","bbc.com","https://www.reddit.com/r/politics/comments/c4xi7j/60000_child_migrants_detained_by_us_in_last_40/?ref=search_posts"
247,"10_1","24-06-19","24-06-19",511,"politics",0.97,4225,"real--life","darkfires",53,0,"Most likely thinking to themselves that they're preventing another [right-wing terrorist attack](https://en.wikipedia.org/wiki/Right-wing_terrorism#United_States) by not triggering the *snow*flakes.","60,000 child migrants detained by US in last 40 days","","https://www.bbc.com/news/av/world-us-canada-48602222/60000-child-migrants-detained-by-us-in-last-40-days?fbclid=IwAR3ubKECRlX4wRPsDJy3XaleEQLCugnVM2O4k8BwUNLSLP_igW2FocAVhZU","bbc.com","https://www.reddit.com/r/politics/comments/c4xi7j/60000_child_migrants_detained_by_us_in_last_40/?ref=search_posts"
248,"10_1_1","24-06-19","25-06-19",511,"politics",0.97,4225,"real--life","[deleted]",0,0,"So, people die or people die. Nice choice the right wing has forced on us.","60,000 child migrants detained by US in last 40 days","","https://www.bbc.com/news/av/world-us-canada-48602222/60000-child-migrants-detained-by-us-in-last-40-days?fbclid=IwAR3ubKECRlX4wRPsDJy3XaleEQLCugnVM2O4k8BwUNLSLP_igW2FocAVhZU","bbc.com","https://www.reddit.com/r/politics/comments/c4xi7j/60000_child_migrants_detained_by_us_in_last_40/?ref=search_posts"
249,"10_2","24-06-19","25-06-19",511,"politics",0.97,4225,"real--life","KalashnaCough",41,0,"It terrifies and saddens me to think it but your post definitely has convinced me, we are likely going to at least be finding mass graves, if not worse. I hope we don't, but these numbers are insane, and the racists are running the show. I feel sick.","60,000 child migrants detained by US in last 40 days","","https://www.bbc.com/news/av/world-us-canada-48602222/60000-child-migrants-detained-by-us-in-last-40-days?fbclid=IwAR3ubKECRlX4wRPsDJy3XaleEQLCugnVM2O4k8BwUNLSLP_igW2FocAVhZU","bbc.com","https://www.reddit.com/r/politics/comments/c4xi7j/60000_child_migrants_detained_by_us_in_last_40/?ref=search_posts"
